video_url,alt_text,title,description,director,dop,colorist,tags,technique_tags
"https://asset.eyecannndy.com/media/clip/2024/02/28/261709105735.webp","Watchtower of Turkey","Watchtower of Turkey (2014)","Described as a visual masterpiece, ""Watchtower of Turkey"" is praised for its breathtaking cinematography, dynamic soundtrack, and impeccable editing. The film takes viewers through vibrant cities and awe-inspiring landscapes, showcasing the country's remarkable diversity and beauty. It's more than just a travel video; it's a tribute to Turkey's rich culture, history, and natural wonders, crafted with an eye for detail and a knack for storytelling.","Leonardo Dalessandri","","","FEET | SHOES | STAIRS | STEPS","Ground Level"
"https://asset.eyecannndy.com/media/clip/2024/03/13/261710332685.webp","Our England","Our England (2022)","","India Harris","","","RUNNING | NIKE | GRASS | GIRL | SHOES | KID","Away from Camera | Close-Up | Ground Level | Tracking"
"https://asset.eyecannndy.com/media/clip/2024/02/28/261709094078.webp","Beethoven","Beethoven (1992)","","Sheldon Kahn, William D. Gordean","Victor J. Kemper","","POV | EXTERIOR | DOG","Animal POV | First-Person | Ground Level"
"https://asset.eyecannndy.com/media/clip/2024/01/15/261705285352.webp","The Matrix","The Matrix (1999)","When a beautiful stranger leads computer hacker Neo to a forbidding underworld, he discovers the shocking truth--the life he knows is the elaborate deception of an evil cyber-intelligence.","Zach Staenberg","Bill Pope","David Orr","INTERIOR | GROUND | TEAL | TURQUOISE | BULLETS | BOOTS","1990s | Action | Ground Level | Slow Motion"
"https://asset.eyecannndy.com/media/clip/2024/03/12/261710225532.webp","The Gentlemen (TV Series)","The Gentlemen (TV Series) (2024)","Season 1. Episode 5. Eddie Horniman inherits a family estate, initially unaware its home to a drug empire run by a syndicate that has no plans to vacate. Created by Guy Ritchie.","Nick Allix","Callan Green","Matthieu Toullet","FEET | SHOES | GOLFING | GOLF COURSE | GOLF CLUB","Close-Up | Ground Level | Slow Motion"
"https://asset.eyecannndy.com/media/clip/2024/03/04/261709545439.webp","Riot & Set it off","Riot & Set it off (2024)","2024 music video directed by Trey Lyons. Features beautiful slow motion sequences and frenetic sequences.","Alex Morrison","Franklin Ricart","Company 3, Joseph Bicknell","EXPLOSION | RUNNING | BLACK AND WHITE | FIRE","Ground Level | Ultra Slow Motion"
"https://asset.eyecannndy.com/media/clip/2024/01/11/261704937496.webp","Nike SB - Don't Make Plans","Nike SB - Don't Make Plans (2021)","","Matt Carter, Pierre Lesnip","","Company 3, Kath Rascih","NIKE | NIGHT | INTERIOR | SHOES","Fast Motion | Ground Level"
"https://asset.eyecannndy.com/media/clip/2023/12/28/261703730550.webp","Evil Dead Rise","Evil Dead Rise (2023)","A twisted tale of two estranged sisters whose reunion is cut short by the rise of flesh-possessing demons, thrusting them into a primal battle for survival as they face the most nightmarish version of family imaginable. Stunning use of a split-diopter lens throughout the film. Shot breakdown: Dutch angle split diopter ground shot.","Bryan Shaw","Dave Garbett","Gary Curran","DAY | INTERIOR | CHILD | ANAMORPHIC | 2020S | ARRI ALEXA MINI LF | PANAVISION LENSES | FLOOR | PANAVISION ULTRA SPEED MKII | PANAVISION ULTRA PANATAR LENSES | PANAVISION G SERIES | KEYS | CRAWL","Dutch Angle | Ground Level | Split Diopter"
"https://asset.eyecannndy.com/media/clip/2024/01/09/261704828675.webp","DJ Pone (ft. Blasé) - All I Want","DJ Pone (ft. Blasé) - All I Want (2023)","","Benoît Marzouvanlian","","","DAY | INTERIOR | GROUND | TRAIN | SUBWAY","Dolly | Ground Level"
"https://asset.eyecannndy.com/media/clip/2024/01/13/261705127896.webp","Tyler The Creator - Dogtooth","Tyler The Creator - Dogtooth (2023)","As described by Fader as ""Wes Anderson-meets-Billionaire Boys Club"".","Tyler Okonma","Luis Perez","","DAY | TYLER THE CREATOR | DOGS","Close-Up | Ground Level | Ultra Wide"
"https://asset.eyecannndy.com/media/clip/2024/01/13/261705179915.webp","The Darjeeling Limited","The Darjeeling Limited (2007)","Wes Anderson directed film in which three brothers travel across India by train in an attempt to bond with each other a year after their fathers death. You're seeing a ground-level shot on a moving platform — in this case, a train.","Andrew Weisblum","Robert D. Yeoman","Walter Volpatto","DAY | EXTERIOR | TRAIN","Ground Level"
"https://asset.eyecannndy.com/media/clip/2024/01/31/261706688358.webp","Honey, I Shrunk the Kids","Honey, I Shrunk the Kids (1989)","The scientist father of a teenage girl and boy accidentally shrinks his and two other neighborhood teens to the size of insects. Now the teens must fight diminutive dangers as the father searches for them.","Michael A. Stevenson","Hiro Narita","","80S | INSECT | BUG | ANT","1980s | Claymation | Ground Level | Miniature | Scale Shift"
"https://asset.eyecannndy.com/media/clip/2024/06/07/261717742555.webp","ONHA - KODAK","ONHA - KODAK (2024)","The music video for ""Kodak"" by ONHA, directed by Nitram, showcases the artist moving through different lively and surreal environments that correspond to playlists on a girl's phone. In one standout scene, ONHA is turned into a basketball, remaining the focal point during a game. The video is praised for its ambitious concept and impressive visual effects, making it a visually captivating experience.","M. Tikal","Virgil Leclercq","Francois Dubois","ONHA - KODAK (2024) | DAY | EXTERIOR | BASKETBALL | BASKETBALL COURT","Anthropo | Ground Level"
"https://asset.eyecannndy.com/media/clip/2024/03/10/261710031160.webp","The Gentlemen (TV Series)","","","","","","",""
"https://asset.eyecannndy.com/media/clip/2024/03/09/261710023878.webp","The Gentlemen (TV Series)","","","","","","",""
"https://asset.eyecannndy.com/media/clip/2024/03/10/261710032391.webp","The Gentlemen (TV Series)","The Gentlemen (TV Series) (2024)","Eddie Horniman inherits a family estate, initially unaware its home to a drug empire run by a syndicate that has no plans to vacate. Created by Guy Ritchie.","David Webb","Bjorn Charpentier, Ed Wild","","BLUNT | WEED | TABLE | HAND","Conveyor | Extreme Close-Up | Ground Level"
"https://asset.eyecannndy.com/media/CACHE/images/clip/2024/03/12/4_Z5Obtl7/3bf5db1b3255c7eb269e602a326df5d7.gif","The Gentlemen (TV Series)","The Gentlemen (TV Series) (2024)","Season 1. Episode 4. Eddie Horniman inherits a family estate, initially unaware its home to a drug empire run by a syndicate that has no plans to vacate. Created by Guy Ritchie.","Dan Sherwen, Matt Platts-Mills","Bjorn Charpentier","Matthieu Toullet","DAY | WATER | EXTERIOR | LAKE | BOAT | FISHING","Water Level"
"https://asset.eyecannndy.com/media/clip/2024/01/24/261706085095.webp","X","","","","","","",""
"https://asset.eyecannndy.com/media/clip/2024/01/16/261705385871.webp","Moonlight","Moonlight (2016)","A young African-American man grapples with his identity and sexuality while experiencing the everyday struggles of childhood, adolescence, and burgeoning adulthood. Directed by Barry Jenkins and shot on an Arri Alexa XT camera.","Joi McMillon, Nat Sanders","James Laxton","Alex Bickel","DAY | WATER | OCEAN | HANDHELD | ANGENIEUX | KOWA | HAWK V-LITE | ARRI ALEXA XT","Underwater | Water Level"
"https://asset.eyecannndy.com/media/clip/2024/01/13/261705179670.webp","X","X (2022)","Ti West directed thriller in which a group of young filmmakers set out to make an adult film in rural Texas, but when their reclusive, elderly hosts catch them in the act, the cast find themselves fighting for their lives.","Ti West","","","X (2022) | WATER | FEET | REFLECTION","Water Level"
"https://asset.eyecannndy.com/media/clip/2024/02/21/261708508040.webp","Unicef - Never Give Up","Unicef - Never Give Up (2022)","","Max Neumeier","Fabio Tozzo","Nadia Khairat Gómez","WATER | OCEAN | LAKE","Handheld | Water Level"
"https://asset.eyecannndy.com/media/clip/2024/01/16/261705385850.webp","Moonlight","Moonlight (2016)","A young African-American man grapples with his identity and sexuality while experiencing the everyday struggles of childhood, adolescence, and burgeoning adulthood. Directed by Barry Jenkins and shot on an Arri Alexa XT camera.","Joi McMillon, Nat Sanders","James Laxton","Alex Bickel","DAY | WATER | OCEAN | HANDHELD | ANGENIEUX | KOWA | HAWK V-LITE | ARRI ALEXA XT","Handheld | Water Level"
"https://asset.eyecannndy.com/media/clip/2024/01/24/261706085119.webp","X","X (2022)","Ti West directed thriller in which a group of young filmmakers set out to make an adult film in rural Texas, but when their reclusive, elderly hosts catch them in the act, the cast find themselves fighting for their lives.","Ti West","","","X (2022) | DAY | WATER | FACE | EXTERIOR | REFLECTION","Close-Up | Water Level"
"https://asset.eyecannndy.com/media/clip/2024/02/28/261709097889.webp","Beethoven","","","","","","",""
"https://asset.eyecannndy.com/media/clip/2024/02/28/261709106054.webp","Watchtower of Turkey","Watchtower of Turkey (2014)","Described as a visual masterpiece, ""Watchtower of Turkey"" is praised for its breathtaking cinematography, dynamic soundtrack, and impeccable editing. The film takes viewers through vibrant cities and awe-inspiring landscapes, showcasing the country's remarkable diversity and beauty. It's more than just a travel video; it's a tribute to Turkey's rich culture, history, and natural wonders, crafted with an eye for detail and a knack for storytelling.","Leonardo Dalessandri","","","WATER","Water Level"
"https://asset.eyecannndy.com/media/clip/2024/01/01/261704069890.webp","Trent Jaklitsch - Alyssa Monks","Trent Jaklitsch - Alyssa Monks (2014)","","Trent Jaklitsch","","","WATER | CLOSE UP | LAKE | REFLECTION | HAND | BOAT | GROUND SHOT","2010s | Cinemagraph | Water Level"
"https://asset.eyecannndy.com/media/clip/2024/03/14/261710392869.webp","SMALL BLACK - Boy’s Life","SMALL BLACK - Boy’s Life (2016)","","","","","","Water Level"
