video_url,alt_text,title,description,director,dop,colorist,tags,technique_tags
"https://asset.eyecannndy.com/media/clip/2024/03/20/261710976709.webp","Usher, H.E.R. - Risk It All","Usher, H.E.R. - Risk It All (2024)","In the 2024 music video 'Risk It All' directed by Dave Meyers, Usher and H.E.R. deliver an emotionally charged performance, underscored by contemporary dance, on a rotating platform in a dimly lit setting. The video, known for its sophisticated yet steamy ambiance, culminates in a poignant moment with Usher tearfully singing the final note. This collaboration is a standout part of 'The Color Purple' soundtrack, showcasing the artistic depth and vulnerability of both artists.","Nathan Rodgers","Scott Cunningham","Pavel Marko","DANCING | SENSUAL | USHER | UNDERWEAR | SUGGESTIVE | BOXERS","Echo print | Lazy Susan | Motion Blur | Speed Ramp | Stationary camera"
"https://asset.eyecannndy.com/media/clip/2024/03/19/261710832875.webp","Oppo - Make Every Shot Stand Out","Oppo - Make Every Shot Stand Out (2024)","","Gramatova Katarina","Filip Marek","Arthur Paux","INTERIOR | HAND | PHONE","Extreme Close-Up | Fast Motion | Motion Blur"
"https://asset.eyecannndy.com/media/clip/2024/01/29/261706500235.webp","Jackboys - Gang Gang","Jackboys - Gang Gang (2019)","2019 music video for Jackboys and directed by Cactus Jack and White Trash Tyler. Produced by Nathan Scherrer & Randy Donaldson for Freenjoy.","Cactus Jack, White Trash Tyler","","","CAR | NIGHT | EXTERIOR","Motion Blur | Step-print"
"https://asset.eyecannndy.com/media/clip/2024/03/02/261709342611.webp","AJ Tracey - Wifey Riddim 4","AJ Tracey - Wifey Riddim 4 (2024)","","Late Milk","Mike Koziel","","YELLOW | NIGHT | TAXI | EXTERIOR | VEHICLE","Fast Motion | Fixed Cam | Motion Blur"
"https://asset.eyecannndy.com/media/clip/2024/02/02/261706901528.webp","Burberry x POP","Burberry x POP (2022)","","Colin Read","Eric Schleicher","Joseph Bicknell","MOTION BLUR | NIGHT | EXTERIOR | SKATING | SKATEBOARD","Low Frame-rate | Motion Blur"
"https://asset.eyecannndy.com/media/clip/2024/02/27/261709019389.webp","Snipes x Nike - The Cypher","Snipes x Nike - The Cypher (2023)","","Alexis Benot, Eugène Signoret","Cesar Decharme","Arthur Paux","GROUP | DANCE | CYPHER","Motion Blur"
"https://asset.eyecannndy.com/media/clip/2023/12/31/261703998428.webp","Metro Boomin & Future - Superhero (Heroes & Villains)","Metro Boomin & Future - Superhero (Heroes & Villains) (2022)","Metro Boomin & Future - Superhero (Heroes & Villains) (2022)","Kenny Shimm (Editor)","Chuk Town","","DAY | EXTERIOR","Jump cut | Motion Blur | Speed Ramp"
"https://asset.eyecannndy.com/media/clip/2024/02/11/261707633084.webp","IKEA – Show Off Your Savvy","IKEA – Show Off Your Savvy (2023)","","Hasani Franke-Harris","Benjamin Todd","Matt Turner","MALE | MOTION BLUR | INTERIOR","Fast Motion | Fourth Wall | Motion Blur | Speed Ramp"
"https://asset.eyecannndy.com/media/clip/2024/02/20/261708402737.webp","Talladega Nights: The Ballad of Ricky Bobby","Talladega Nights: The Ballad of Ricky Bobby (2006)","Number one NASCAR driver Ricky Bobby stays atop the heap thanks to a pact with his best friend and teammate, Cal Naughton, Jr. But when a French Formula One driver, makes his way up the ladder, Ricky Bobby's talent and devotion are put to the test.","Brent White","Oliver Wood","Joe Finley","RACING | EXTERIOR | STADIUM | NASCAR | RACETRACK | RACE CAR","Motion Blur | Quick Cuts"
"https://asset.eyecannndy.com/media/clip/2024/02/02/261706902404.webp","Burberry x POP","Burberry x POP (2022)","","Colin Read","Eric Schleicher","Joseph Bicknell","NIGHT | EXTERIOR | REFLECTIVE | GLOW","Duplication | Echo print | Fast Motion | Motion Blur | Silhouette"
"https://asset.eyecannndy.com/media/clip/2024/02/11/261707625980.webp","Lil Uzi Vert - Just Wanna Rock","Lil Uzi Vert - Just Wanna Rock (2022)","2022 music video for Lil Uzi Vert from renowned artist, Gibson Hazard. Produced in collaboration between House of Hazard and ShotClock. Visual effects from Black Hat VFX.","Chris Villa, Kenny Shimm (Editor)","Cory Burmester","Josh Bohoskey, Matt Osborne","NIGHT | EXTERIOR | DARK | VEHICLE","Altered state | Fast Motion | Fixed Cam | Inebriation | Motion Blur"
"https://asset.eyecannndy.com/media/clip/2024/01/29/261706500446.webp","Fallen Angels","Fallen Angels (1995)","This Hong Kong-set crime drama follows the lives of a hitman, hoping to get out of the business, and his elusive female partner.","Wong Kar-Wai","","","WARM | INTERIOR","Low Frame-rate | Motion Blur"
"https://asset.eyecannndy.com/media/clip/2024/02/02/261706902448.webp","Burberry x POP","Burberry x POP (2022)","","Colin Read","Eric Schleicher","Joseph Bicknell","NIGHT | EXTERIOR | SKATING | SKATEBOARD | REFLECTIVE | GLOW","Fast Motion | Handheld | Motion Blur"
"https://asset.eyecannndy.com/media/clip/2024/03/20/261710976637.webp","Usher, H.E.R. - Risk It All","Usher, H.E.R. - Risk It All (2024)","In the 2024 music video 'Risk It All' directed by Dave Meyers, Usher and H.E.R. deliver an emotionally charged performance, underscored by contemporary dance, on a rotating platform in a dimly lit setting. The video, known for its sophisticated yet steamy ambiance, culminates in a poignant moment with Usher tearfully singing the final note. This collaboration is a standout part of 'The Color Purple' soundtrack, showcasing the artistic depth and vulnerability of both artists.","Nathan Rodgers","Scott Cunningham","Pavel Marko","DANCING | SENSUAL | USHER | UNDERWEAR | SUGGESTIVE | BOXERS","Echo print | Lazy Susan | Motion Blur | Speed Ramp | Stationary camera"
"https://asset.eyecannndy.com/media/clip/2024/03/04/261709545953.webp","Riot & Set it off","Riot & Set it off (2024)","2024 music video directed by Trey Lyons. Features beautiful slow motion sequences and frenetic sequences.","Alex Morrison","Franklin Ricart","Company 3, Joseph Bicknell","INTERIOR | OFFICE","Echo print | Fast Motion | High Angle | Motion Blur"
"https://asset.eyecannndy.com/media/clip/2024/03/20/261710976682.webp","Usher, H.E.R. - Risk It All","Usher, H.E.R. - Risk It All (2024)","In the 2024 music video 'Risk It All' directed by Dave Meyers, Usher and H.E.R. deliver an emotionally charged performance, underscored by contemporary dance, on a rotating platform in a dimly lit setting. The video, known for its sophisticated yet steamy ambiance, culminates in a poignant moment with Usher tearfully singing the final note. This collaboration is a standout part of 'The Color Purple' soundtrack, showcasing the artistic depth and vulnerability of both artists.","Nathan Rodgers","Scott Cunningham","Pavel Marko","DANCING | SENSUAL | USHER | UNDERWEAR | SUGGESTIVE | BOXERS","Echo print | Lazy Susan | Motion Blur | Speed Ramp | Stationary camera"
"https://asset.eyecannndy.com/media/clip/2024/01/14/261705213351.webp","Vaeda Black - Run Fast","Vaeda Black - Run Fast (2019)","Shot breakdown: Slit-scan motion blur + double exposure","Jacobi Mehringer, Justin Leyba","Nat Pinhiero","","MOTION BLUR | BLUR | MUSIC VIDEO | INTERIOR | JUSTIN LEYBA | JACOBI MEHRINGER | VAEDA BLACK","Double Exposure | Motion Blur | Slit-scan"
"https://asset.eyecannndy.com/media/clip/2024/02/02/261706902516.webp","Burberry x POP","Burberry x POP (2022)","","Colin Read","Eric Schleicher","Joseph Bicknell","NIGHT | EXTERIOR | SKATING | SKATEBOARD | REFLECTIVE | GLOW","Fast Motion | Handheld | Motion Blur"
"https://asset.eyecannndy.com/media/clip/2024/02/19/261708334745.webp","Dua Lipa - Training Season","Dua Lipa - Training Season (2024)","In the ""Training Season"" video, Dua Lipa remains composed at a cafe, surrounded by gawking men taking photos of her. The song's inspiration, as shared by Lipa, stemmed from a series of bad dates, leading her to declare the end of her ""training season"" and shaping the song with songwriters Caroline Ailin and Tobias Jesso Jr.","Julie Levy","Rina Yang","Dante Pasquinelli","RESTAURANT | INTERIOR | GROUP | CROWD | DUA LIPA","Echo print | High Angle | Motion Blur"
"https://asset.eyecannndy.com/media/clip/2024/03/19/261710830468.webp","Aritzia - Sweatfleece","Aritzia - Sweatfleece (2024)","","Miloš Bogojevic","Thomas Marchese","Dylan Hageman","INTERIOR | STUDIO | PHOTOGRAPHY | MODEL","Fast Motion | Motion Blur"
"https://asset.eyecannndy.com/media/clip/2024/02/27/261709019537.webp","Snipes x Nike - The Cypher","Snipes x Nike - The Cypher (2023)","","Alexis Benot, Eugène Signoret","Cesar Decharme","Arthur Paux","GROUP | DANCE | CYPHER","Lazy Susan | Low Frame-rate | Motion Blur"
"https://asset.eyecannndy.com/media/clip/2024/02/19/261708334620.webp","Dua Lipa - Training Season","Dua Lipa - Training Season (2024)","In the ""Training Season"" video, Dua Lipa remains composed at a cafe, surrounded by gawking men taking photos of her. The song's inspiration, as shared by Lipa, stemmed from a series of bad dates, leading her to declare the end of her ""training season"" and shaping the song with songwriters Caroline Ailin and Tobias Jesso Jr.","Julie Levy","Rina Yang","Dante Pasquinelli","RESTAURANT | INTERIOR | GROUP | CROWD | DUA LIPA","Echo print | High Angle | Motion Blur"
"https://asset.eyecannndy.com/media/clip/2024/02/15/261707978134.webp","Rosalia - Saoko","Rosalia - Saoko (2022)","Rosalía and her motorcycle girl gang run riot in Valentin Petit's brilliant video for Saoko, the first track from the Spanish superstar's latest album Motomami. Shot breakdown: Ultra Wide Zero distortion lens low angle tracking in shot.","Jon Echeveste","Paul Guilhaume","Arthur Paux","","Motion Blur | Quick Cuts"
"https://asset.eyecannndy.com/media/clip/2024/04/01/261711984439.webp","Face","Face (2021)","","Mah Ferraz","Mayer Chalom","Carlos Flores","WOMAN | BLUE | STUDIO | SELFIE | CROWD | PHONE | CIRCLE","Fast Motion | Motion Blur | Video Portraits"
"https://asset.eyecannndy.com/media/clip/2024/07/07/261720385427.webp","The Dare - Perfume","The Dare - Perfume (2024)","The ""The Dare - Perfume 2024"" commercial is an evocative and visually striking advertisement that captures the essence of boldness and sensuality. It features a series of elegantly choreographed scenes where the protagonist moves through various luxurious settings, exuding confidence and allure. The commercial employs a rich color palette and dramatic lighting to highlight the sophistication and intensity of the perfume. The narrative is punctuated by close-up shots of the perfume bottle, emphasizing its sleek design and the brand's logo, leaving a lasting impression of elegance and daring on the viewer.","Josh Wehle","Ben Carey","Myles Bevan","BLACK AND WHITE","Collage | Conveyor | Motion Blur | Speed Ramp"
"https://asset.eyecannndy.com/media/clip/2024/02/19/261708333800.webp","Dua Lipa - Training Season","Dua Lipa - Training Season (2024)","In the ""Training Season"" video, Dua Lipa remains composed at a cafe, surrounded by gawking men taking photos of her. The song's inspiration, as shared by Lipa, stemmed from a series of bad dates, leading her to declare the end of her ""training season"" and shaping the song with songwriters Caroline Ailin and Tobias Jesso Jr.","Julie Levy","Rina Yang","Dante Pasquinelli","MOTION BLUR | RESTAURANT | INTERIOR","Echo print | Motion Blur"
"https://asset.eyecannndy.com/media/clip/2024/02/27/261709020374.webp","Snipes x Nike - The Cypher","Snipes x Nike - The Cypher (2023)","","Alexis Benot, Eugène Signoret","Cesar Decharme","Arthur Paux","GROUP | DANCE | CYPHER","Echo print | Motion Blur | Overhead"
"https://asset.eyecannndy.com/media/clip/2024/01/24/261706086523.webp","Chungking Express","Chungking Express (1994)","Two melancholic Hong Kong policemen fall in love: one with a mysterious female underworld figure, the other with a beautiful and ethereal waitress at a late-night restaurant he frequents. Shot on Agfa stock and XT320 cameras.","Chi-Leung Kwong, Hai Kit-Wai, William Chang","Andrew Lau, Christopher Doyle","Joe Gawler","RESTAURANT | BLUE | INTERIOR | BAR","Fast Motion | Motion Blur"
"https://asset.eyecannndy.com/media/clip/2024/07/07/261720384360.webp","Omega - Road to the Olympics","Omega - Road to the Olympics (2024)","The ""Omega - Road to the Olympics 2024"" commercial celebrates Omega's role as the Official Timekeeper for the Paris 2024 Olympics, a position they've held since 1932. The commercial features athletes training and competing, emphasizing Omega's precision and innovation in timekeeping technology. It also highlights the launch of a special edition Seamaster watch, designed to commemorate the upcoming Olympics.","Alexis Benot","Mathieu Plainfossé","Vincent Amor","WATER | POOL | SPORTS | BLUE | ATHLETE | OLYMPICS | SWIMMING | MICHAEL PHELPS","Double Exposure | Echo print | Motion Blur"
"https://asset.eyecannndy.com/media/clip/2023/12/20/261703108172.webp","Sampha - Sampha - Can't Go Back","Sampha - Sampha - Can't Go Back (2023)","Directed by Saad Moosajee. An abstract visual journey centered around an eclipse.","Cabin Edit, Dylan Edwards","Maximilian Pittner","No 8, Tim Smith","BLUR | CLOSE UP | ABSTRACT | BLACK AND WHITE | DARK","Motion Blur"
"https://asset.eyecannndy.com/media/clip/2024/05/13/261715643920.webp","Oblé Reed - WESTON.","Oblé Reed - WESTON. (2023)","","Nash Pearson","","","MALE | JACKET | ROAD | NIGHT | SPOTLIGHT | LETTERMAN JACKET","Handheld | Motion Blur | Spotlight | Ultra Wide"
"https://asset.eyecannndy.com/media/clip/2024/02/20/261708402674.webp","Talladega Nights: The Ballad of Ricky Bobby","Talladega Nights: The Ballad of Ricky Bobby (2006)","Number one NASCAR driver Ricky Bobby stays atop the heap thanks to a pact with his best friend and teammate, Cal Naughton, Jr. But when a French Formula One driver, makes his way up the ladder, Ricky Bobby's talent and devotion are put to the test.","Brent White","Oliver Wood","Joe Finley","MOTION BLUR | RACING | EXTERIOR | STADIUM | CROWD | FANS | NASCAR | RACETRACK","Motion Blur | Tilt"
"https://asset.eyecannndy.com/media/clip/2024/02/20/261708402935.webp","Talladega Nights: The Ballad of Ricky Bobby","Talladega Nights: The Ballad of Ricky Bobby (2006)","Number one NASCAR driver Ricky Bobby stays atop the heap thanks to a pact with his best friend and teammate, Cal Naughton, Jr. But when a French Formula One driver, makes his way up the ladder, Ricky Bobby's talent and devotion are put to the test.","Brent White","Oliver Wood","Joe Finley","RACING | EXTERIOR | STADIUM | NASCAR | RACETRACK | RACE CAR","Motion Blur | Whip Transition"
"https://asset.eyecannndy.com/media/clip/2024/06/07/261717742372.webp","ONHA - KODAK","ONHA - KODAK (2024)","The music video for ""Kodak"" by ONHA, directed by Nitram, showcases the artist moving through different lively and surreal environments that correspond to playlists on a girl's phone. In one standout scene, ONHA is turned into a basketball, remaining the focal point during a game. The video is praised for its ambitious concept and impressive visual effects, making it a visually captivating experience.","M. Tikal","Virgil Leclercq","Francois Dubois","ONHA - KODAK (2024) | MALE | SPIN","Locked-on Lazy Susan | Motion Blur"
"https://asset.eyecannndy.com/media/clip/2024/02/19/261708334489.webp","Dua Lipa - Training Season","Dua Lipa - Training Season (2024)","In the ""Training Season"" video, Dua Lipa remains composed at a cafe, surrounded by gawking men taking photos of her. The song's inspiration, as shared by Lipa, stemmed from a series of bad dates, leading her to declare the end of her ""training season"" and shaping the song with songwriters Caroline Ailin and Tobias Jesso Jr.","Julie Levy","Rina Yang","Dante Pasquinelli","RESTAURANT | INTERIOR | GROUP | CROWD | DUA LIPA","Echo print | Motion Blur"
"https://asset.eyecannndy.com/media/clip/2024/07/07/261720384475.webp","Omega - Road to the Olympics","Omega - Road to the Olympics (2024)","The ""Omega - Road to the Olympics 2024"" commercial celebrates Omega's role as the Official Timekeeper for the Paris 2024 Olympics, a position they've held since 1932. The commercial features athletes training and competing, emphasizing Omega's precision and innovation in timekeeping technology. It also highlights the launch of a special edition Seamaster watch, designed to commemorate the upcoming Olympics.","Alexis Benot","Mathieu Plainfossé","Vincent Amor","WATER | POOL | SPORTS | BLUE | ATHLETE | OLYMPICS | SWIMMING | MICHAEL PHELPS","Echo print | Motion Blur"
"https://asset.eyecannndy.com/media/clip/2024/03/02/261709342610.webp","AJ Tracey - Wifey Riddim 4","AJ Tracey - Wifey Riddim 4 (2024)","","Late Milk","Mike Koziel","","YELLOW | NIGHT | TAXI | EXTERIOR | VEHICLE","Fast Motion | Fixed Cam | Motion Blur"
"https://asset.eyecannndy.com/media/clip/2024/03/13/261710313059.webp","Carousel GIF by Dave Gorum","Carousel GIF by Dave Gorum (2015)","","","","","NIGHT | EXTERIOR | CAROUSEL","Echo print | Fast Motion | Motion Blur"
"https://asset.eyecannndy.com/media/clip/2024/02/20/261708472556.webp","Lil Nas X, Youngboy Never Broke Again - Late To Da Party","Lil Nas X, Youngboy Never Broke Again - Late To Da Party (2022)","The music video for ""Late to da Party (F*ck BET)"" by Lil Nas X and YoungBoy Never Broke Again features provocative imagery, including Lil Nas X urinating on a BET Award, to criticize and satirize the entertainment industry, particularly for Lil Nas X's exclusion from BET Awards nominations.","Chris Villa","Russ Fraser","","INTERIOR | LIL NAS X | RECORD STUDIO","Echo print | Fast Motion | Motion Blur | Ultra Wide"
"https://asset.eyecannndy.com/media/clip/2024/01/24/261706086989.webp","Chungking Express","Chungking Express (1994)","Two melancholic Hong Kong policemen fall in love: one with a mysterious female underworld figure, the other with a beautiful and ethereal waitress at a late-night restaurant he frequents. Shot on Agfa stock and XT320 cameras.","Chi-Leung Kwong, Hai Kit-Wai, William Chang","Andrew Lau, Christopher Doyle","Joe Gawler","NIGHT | TWO SHOT | EXTERIOR | FIGHT | VIOLENCE","Low Frame-rate | Motion Blur"
"https://asset.eyecannndy.com/media/clip/2024/03/19/261710830498.webp","Aritzia - Sweatfleece","","","","","","",""
"https://asset.eyecannndy.com/media/clip/2024/07/05/261720164076.webp","Bree Runway - Just Like That","Aritzia - Sweatfleece (2024)","","Miloš Bogojevic","Thomas Marchese","Dylan Hageman","INTERIOR | STUDIO | PHOTOGRAPHY | MODEL","Fast Motion | Motion Blur"
"https://asset.eyecannndy.com/media/clip/2024/02/28/261709102742.webp","Watchtower of Turkey","Watchtower of Turkey (2014)","Described as a visual masterpiece, ""Watchtower of Turkey"" is praised for its breathtaking cinematography, dynamic soundtrack, and impeccable editing. The film takes viewers through vibrant cities and awe-inspiring landscapes, showcasing the country's remarkable diversity and beauty. It's more than just a travel video; it's a tribute to Turkey's rich culture, history, and natural wonders, crafted with an eye for detail and a knack for storytelling.","Leonardo Dalessandri","","","BEACH | RUNNING | FEET","Motion Blur | Overhead Close-up"
"https://asset.eyecannndy.com/media/clip/2024/02/02/261706902361.webp","Burberry x POP","Burberry x POP (2022)","","Colin Read","Eric Schleicher","Joseph Bicknell","NIGHT | EXTERIOR | REFLECTIVE | GLOW","Fast Motion | Handheld | Motion Blur | Void"
"https://asset.eyecannndy.com/media/clip/2023/12/19/261702983797.webp","Heracles GIF By Hateplow","Heracles GIF By Hateplow (2015)","","hateplow","","","","3D animation | Motion Blur"
"https://asset.eyecannndy.com/media/clip/2024/02/27/261709019597.webp","Snipes x Nike - The Cypher","Snipes x Nike - The Cypher (2023)","","Alexis Benot, Eugène Signoret","Cesar Decharme","Arthur Paux","GROUP | DANCE | CYPHER","Arc | Motion Blur | Void"
"https://asset.eyecannndy.com/media/clip/2024/02/19/261708334823.webp","Dua Lipa - Training Season","Dua Lipa - Training Season (2024)","In the ""Training Season"" video, Dua Lipa remains composed at a cafe, surrounded by gawking men taking photos of her. The song's inspiration, as shared by Lipa, stemmed from a series of bad dates, leading her to declare the end of her ""training season"" and shaping the song with songwriters Caroline Ailin and Tobias Jesso Jr.","Julie Levy","Rina Yang","Dante Pasquinelli","RESTAURANT | INTERIOR | GROUP | CROWD | DUA LIPA","Echo print | Motion Blur"
"https://asset.eyecannndy.com/media/clip/2024/03/27/261711529358.webp","Source unknown","Source unknown","","","","","","Echo print | Motion Blur"
"https://asset.eyecannndy.com/media/clip/2024/06/07/261717742331.webp","ONHA - KODAK","ONHA - KODAK (2024)","The music video for ""Kodak"" by ONHA, directed by Nitram, showcases the artist moving through different lively and surreal environments that correspond to playlists on a girl's phone. In one standout scene, ONHA is turned into a basketball, remaining the focal point during a game. The video is praised for its ambitious concept and impressive visual effects, making it a visually captivating experience.","M. Tikal","Virgil Leclercq","Francois Dubois","ONHA - KODAK (2024) | MALE | SPIN","Jump cut | Locked-on Lazy Susan | Motion Blur"
