video_url,alt_text,title,description,director,dop,colorist,tags,technique_tags
"https://asset.eyecannndy.com/media/clip/2024/03/10/261710030506.webp","The Gentlemen (TV Series)","The Gentlemen (TV Series) (2024)","Eddie Horniman inherits a family estate, initially unaware its home to a drug empire run by a syndicate that has no plans to vacate. Created by Guy Ritchie.","David Webb","Bjorn Charpentier, Ed Wild","","WEED | INTERIOR | MARIJUANA","Overhead | Overhead conveyor"
"https://asset.eyecannndy.com/media/clip/2024/02/11/261707642341.webp","Nu Genea - Marechià (with Célia Kameni)","Nu Genea - Marechià (with Célia Kameni) (2021)","Nu Genea - Marechià (with Célia Kameni) (2021)","Fabio Gargano, Guido Lombardi","","","WATER | OCEAN | TWO SHOT","Flying | Overhead | Stylistic Suck | Two Shot"
"https://asset.eyecannndy.com/media/clip/2024/02/18/261708246680.webp","Latto - Sunday Service","Latto - Sunday Service (2024)","2024 music video for Latto from renowned director HIDJI WORLD. Produced by North of Now films.","HIDJI WORLD","Leroy Farrell","","CONVENIENCE STORE | INTERIOR | BODEGA | COUNTER","Live action pixelation | Overhead"
"https://asset.eyecannndy.com/media/clip/2023/12/23/261703364350.webp","Source Unknown","Source Unknown","Source Unknown H/T @lloydewinteriv / Giphy Technique - Camera Roll , Overhead INTERIOR BED DARK OVERHEAD","","","","INTERIOR | BED | DARK | OVERHEAD","Camera Roll | Overhead"
"https://asset.eyecannndy.com/media/clip/2024/01/01/261704071615.webp","Cinemagraph by Daria Khoroshavina","Cinemagraph by Daria Khoroshavina","The project Kitchen Ghosts is about food, drinks and other little precious moments of life captured and looped in live photographs.","Daria Khoroshavina","","","OVERHEAD | BOOK | LEAVES | TEA | LIME | PIE","Cinemagraph | Overhead"
"https://asset.eyecannndy.com/media/clip/2024/01/01/261704118356.webp","Lazy Susan","Lazy Susan (2019)","You might be one of the millions of people whose life was made a little bit easier by Susan and you don’t even know it. Shot breakdown: Overhead tracking shot.","Terri Timely","Donavan Sell","Clinton Homuth","INTERIOR | TABLE | OVERHEAD | FOOD","Overhead | Tracking"
"https://asset.eyecannndy.com/media/clip/2024/02/11/261707686929.webp","Macpac - This is a Bit Precarious","Macpac - This is a Bit Precarious (2023)","Macpac - This is a Bit Precarious (2023)","Simon Price","James Brown","Matic Prusnik","DAY | NATURE | EXTERIOR | CLIFFHANGER | ROCK CLIMBING","Overhead"
"https://asset.eyecannndy.com/media/clip/2024/01/04/261704385442.webp","Asteroid City","Asteroid City (2023)","Following a writer on his world famous fictional play about a grieving father who travels with his tech-obsessed family to small rural Asteroid City to compete in a junior stargazing event, only to have his world view disrupted forever.","Barney Pilling","Robert Yeoman","Gareth Spensley","DAY | GOLD | WES ANDERSON | INTERIOR | COOL | 2.39 ANAMORPHIC | FILM 35MM | ZEISS MASTER ANAMORPHICS | COOKE S4/ I | DESERT | ARRICAM LT | ARRICAM ST | CYAN | TELESCOPE","1950s | Indifference | Overhead"
"https://asset.eyecannndy.com/media/clip/2024/02/11/261707685882.webp","The Aviator","The Aviator (2004)","A biopic depicting the early years of legendary director and aviator Howard Hughes' career from the late 1920s to the mid 1940s.","Thelma Schoonmaker","Robert Richardson","Stephen Nakamura","EXTERIOR | PLANE | AVIATOR","Overhead | Overhead Tracking"
"https://asset.eyecannndy.com/media/clip/2024/02/11/261707683786.webp","The Last Temptation of Christ","The Last Temptation of Christ (1988)","The life of Jesus Christ, his journey through life as he faces the struggles all humans do, and his final temptation on the cross.","Thelma Schoonmaker","Michael Ballhaus","","DAY | EXTERIOR","Overhead"
"https://asset.eyecannndy.com/media/clip/2024/02/11/261707632605.webp","Jordan - The Winning Moment","Jordan - The Winning Moment (2015)","Produced by Lunar Films and Smuggler and directed by Brian Beletic, the epic and motivational spot tracks back from a match-winning shot to try and find The Winning Moment before.","Biff Butler, Rock Paper Scissors","Dion Beebe","","SPORTS | INTERIOR | ATHLETE | BASKETBALL COURT","Overhead | Slow Motion"
"https://asset.eyecannndy.com/media/clip/2024/01/13/261705127688.webp","Tyler The Creator - Dogtooth","Tyler The Creator - Dogtooth (2023)","As described by Fader as ""Wes Anderson-meets-Billionaire Boys Club"".","Tyler Okonma","Luis Perez","","DAY | TYLER THE CREATOR | CAR | DRIVING | DAYLIGHT | DRIFTING","Fixed Cam | Overhead"
"https://asset.eyecannndy.com/media/clip/2024/07/13/261720850298.webp","Jhula - Manish Khushalani","Jhula - Manish Khushalani (2024)","The music video for ""Jhula"" by Manish Khushalani, released in 2024, explores themes of vulnerability, trust, and the delicate nature of relationships. The video combines Indian classical elements with contemporary electronic music, creating a unique visual and auditory experience. The narrative is driven by a series of intimate and evocative scenes that reflect the song's emotional depth, showcasing a blend of traditional and modern aesthetics that highlight the fusion of cultural influences. The visuals are crafted to complement the haunting melody and poignant lyrics, making for a captivating and immersive experience.","Manish Khushalani","","Vineesh Vijayan","DAY | PINK | FEET | WOMEN | DRESS | GRASS | TWO SHOT | EXTERIOR | PANTS | FLOATING | BAREFOOT","Levitation | Match Cut | Overhead | Two Shot"
"https://asset.eyecannndy.com/media/clip/2024/02/28/261709094892.webp","Beethoven","Beethoven (1992)","A slobbering St. Bernard becomes the center of attention for a loving family, but must contend with a dog-napping veterinarian and his henchmen. Suggested by a brilliant Creative Director.","Sheldon Kahn, William D. Gordean","Victor J. Kemper","","HOUSE | EXTERIOR | FENCE | BACKYARD | DOGHOUSE","Overhead"
"https://asset.eyecannndy.com/media/clip/2024/02/08/261707404088.webp","Her Morning Elegance","Her Morning Elegance (2009)","A collaborative stop motion film by musician Oren Lavie and Israeli photographer Eyal Landesman. The only stop-motion video to ever earn a grammy nomination, this whimsical video accompanies the song of same name by Lavie. The camera remains stationary while bedroom linens and clothing move across the mattress as personifications of the birds, trains, and fish she dreams of.","Oren Lavie, Yuval and Merav Nathan","Eyal Landsman","","DAY | WOMAN | INTERIOR | BEDROOM | OVERHEAD","Overhead | Pixilation | Stop Motion"
"https://asset.eyecannndy.com/media/clip/2023/12/24/261703388330.webp","Halfprice - Fitting room","Halfprice - Fitting room (2022)","Halfprice - Fitting room (2022)","Nikodem Chabior","Mikołaj Syguda","Florian Martiny","BLUE | INTERIOR | OVERHEAD | FASHION | CHANGING ROOM","Match Cut | Overhead"
"https://asset.eyecannndy.com/media/clip/2024/02/14/261707900386.webp","The French Dispatch","The French Dispatch (2021)","A love letter to journalists set in an outpost of an American newspaper in a fictional twentieth century French city that brings to life a collection of stories published in ""The French Dispatch Magazine"".","Andrew Weisblum","Robert Yeoman","Gareth Spensley","BLACK AND WHITE | TYPEWRITER","1960s | Overhead"
"https://asset.eyecannndy.com/media/clip/2023/12/23/261703365628.webp","Husky - Never-ever","Husky - Never-ever (2020)","A guy works as a janitor and cleans up gang fight scenes.","Kirill Khandurin","Kirill Groshev","","WARM | INTERIOR | DARK | ORANGE | OVERHEAD","Camera Roll | Overhead"
"https://asset.eyecannndy.com/media/clip/2024/01/29/261706567224.webp","The Grand Budapest Hotel","The Grand Budapest Hotel (2014)","A visually stunning and comedic masterpiece set in an eccentric Eastern European hotel.","Barney Pilling","Robert Yeoman","Jill Bogdanowicz","RED | HOTEL | INTERIOR | OVERHEAD | BUDAPEST","Overhead"
"https://asset.eyecannndy.com/media/clip/2024/02/21/261708507751.webp","Unicef - Never Give Up","Unicef - Never Give Up (2022)","Unicef - Never Give Up (2022) Technique - Overhead Director - Alexander Tank DOP - Fabio Tozzo Editor - Max Neumeier Colorist - Nadia Khairat Gómez Original Source - Link","Max Neumeier","Fabio Tozzo","Nadia Khairat Gómez","","Overhead"
"https://asset.eyecannndy.com/media/clip/2024/01/13/261705176089.webp","Mammut - Fast Hiking","Mammut - Fast Hiking (2022)","Video advert for Mammut from Swiss director Kris Lüdi featuring sweeping landscape shots, hand-held shaky cam techniques, and a locked-on sequence.","Kris Lüdi","","Yves Roy Vallaster","DAY | RUNNING | NATURE | SPORTS | EXTERIOR | MOUNTAIN | ATHLETE | WILDERNESS | HIKING | RUN","Locked-On | Overhead | Single shot"
"https://asset.eyecannndy.com/media/clip/2024/02/02/261706903307.webp","Converse - AS-1 Pro","Converse - AS-1 Pro (2023)","2023 advert for Converse from director COLIN READ (Mandible Claw). Features an Infinite Dolly effect throughout the film. Produced by SEA COW and MIRMADE. Color by ETHOS.","Daer Niloc","Eric Schleicher","ETHOS, Joseph Bicknell, Kaitlyn Battistelli","DAY | EXTERIOR","Overhead | Super Zoom | Zoom out"
"https://asset.eyecannndy.com/media/clip/2024/03/01/261709330025.webp","Graubünden - Best Version (DC)","Graubünden - Best Version (DC) (2024)","Graubünden - Best Version (DC) (2024)","Thomas Cervenca","Pierre Castillo Bernad","Nurali Kushkov","DAY | EXTERIOR | LAKE","Aerial | Crash Zoom | FPV Drone | Overhead | Tilt"
"https://asset.eyecannndy.com/media/clip/2024/01/09/261704835613.webp","Nike - Nothing Beats a Londoner","Nike - Nothing Beats a Londoner (2018)","Energetic and competitive, London's youth, portrayed in Nike's now iconic commercial showcase their city and sporting prowess, inspired by local icons.","Joe Guest","Nicolas Loir","","DAY | EXTERIOR | RAIN | OVERHEAD | TENNIS","Overhead"
"https://asset.eyecannndy.com/media/clip/2024/02/14/261707900809.webp","Better Call Saul (TV Series)","Better Call Saul (TV Series) (2015)","The trials and tribulations of criminal lawyer Jimmy McGill in the years leading up to his fateful run-in with Walter White and Jesse Pinkman.","Skip Macdonald","Arthur Albert","Ted Brady","DAY | EXTERIOR | DESERT","Overhead | Overhead Birds-Eye"
"https://asset.eyecannndy.com/media/clip/2023/12/23/261703367160.webp","Husky - Never-ever","Husky - Never-ever (2020)","A guy works as a janitor and cleans up gang fight scenes.","Kirill Khandurin","Kirill Groshev","","YELLOW | WARM | INTERIOR | DARK | ORANGE | OVERHEAD","Jump cut | Overhead"
"https://asset.eyecannndy.com/media/clip/2023/12/28/261703732964.webp","Jennifer's Body","Jennifer's Body (2009)","A newly-possessed high-school cheerleader turns into a succubus who specializes in killing her male classmates. Can her best friend put an end to the horror? Shot breakdown: Overhead slow motion.","Plummy Tucker","M. David Mullen","Mitch Paulson","NIGHT | INTERIOR | DARK | COOL | 35MM | SUPER 35 | PANAVISION PRIMO PRIMES | 3 PERF | PHANTOM HD GOLD | PANAVISION GOLD / G2","Falling | Overhead | Slow Motion"
"https://asset.eyecannndy.com/media/clip/2024/03/09/261710025596.webp","The Gentlemen (TV Series)","The Gentlemen (TV Series) (2024)","Eddie Horniman inherits a family estate, initially unaware its home to a drug empire run by a syndicate that has no plans to vacate. Created by Guy Ritchie.","James Herbert","Ed Wild","","INTERIOR | MONEY | CASH | TABLE","Overhead"
"https://asset.eyecannndy.com/media/clip/2024/01/01/261704119733.webp","First Hawaiian Bank - Dance Party","First Hawaiian Bank - Dance Party (2022)","First Hawaiian Bank - Dance Party (2022)","Ariel Danziger","Jeremy Snell","","INTERIOR | TABLE | PHONES | CREDIT CARD","Camera Roll | Fast Motion | Overhead"
"https://asset.eyecannndy.com/media/clip/2024/01/29/261706565688.webp","The French Dispatch","The French Dispatch (2021)","A love letter to journalists set in an outpost of an American newspaper in a fictional twentieth century French city that brings to life a collection of stories published in ""The French Dispatch Magazine"". Shot breakdown. Dolly out to wide.","Andrew Weisblum","Robert Yeoman","Gareth Spensley","HAND | DRAWING | PAPER | CHICKEN | ART | OUTLINE","1960s | Overhead | Overhead Close-up"
"https://asset.eyecannndy.com/media/clip/2024/01/04/261704342082.webp","Elderbrook - Why Do We Shake In The Cold?","Elderbrook - Why Do We Shake In The Cold? (2020)","Elderbrook - Why Do We Shake In The Cold? (2020)","Katarina Gramatová","Filip Marek","","DAY | INTERIOR | LARGE ROOM","Camera Roll | Light Flash | Overhead"
"https://asset.eyecannndy.com/media/clip/2023/12/24/261703401642.webp","adidas Originals - Original Is Never Finished","adidas Originals - Original Is Never Finished (2018)","The second installment of the now iconic Original is Never Finished campaign. This shot would be categorized as an overhead stop motion duplication conveyor shot to cut-in. A cut-in is literally when we ""cut-in"" from a wider shot to a closer shot. It's a staple of Wes Anderson and Edgar Wright. The stop-motion in this scene is subtle but enough to be catalogued.","Christie Brown, Gian Buazulli","Mattias Rudh","Company 3, Tom Poole","INTERIOR | COOL | OVERHEAD | COOL WHITE","Conveyor | Cut-ins | Overhead | Stop Motion"
"https://asset.eyecannndy.com/media/clip/2024/02/11/261707683496.webp","The Aviator","The Aviator (2004)","A biopic depicting the early years of legendary director and aviator Howard Hughes' career from the late 1920s to the mid 1940s.","Thelma Schoonmaker","Robert Richardson","Stephen Nakamura","INTERIOR | BATHROOM | SINK | WASH","Overhead"
"https://asset.eyecannndy.com/media/clip/2024/02/14/261707900920.webp","EA SPORTS FC x Triangles ft. Dave","EA SPORTS FC x Triangles ft. Dave (2023)","EA SPORTS FC x Triangles ft. Dave (2023)","","","","EXTERIOR | FIELD | SOCCER | ATHLETE | EA SPORTS","Overhead | Overhead Birds-Eye | Super Zoom"
"https://asset.eyecannndy.com/media/clip/2023/12/22/261703285465.webp","Animation by Cole Quigley","Animation by Cole Quigley","Animation by Cole Quigley Technique - Flash Cut , Infinite Loop , Infinite Zoom , Overhead Director - Cole Quigley DAY CAR OVERHEAD SNOW BIRDS EYE","Cole Quigley","","","DAY | CAR | OVERHEAD | SNOW | BIRDS EYE","Flash Cut | Infinite Loop | Infinite Zoom | Overhead"
"https://asset.eyecannndy.com/media/clip/2024/01/07/261704609097.webp","Carly Gibert - Dropping Seeds","Carly Gibert - Dropping Seeds (2023)","Carly Gibert - Dropping Seeds (2023)","Christopher A. Medina","Sonali Chugani","Ben Cerauli","RED | CAR | TWO SHOT | OVERHEAD","Overhead"
"https://asset.eyecannndy.com/media/clip/2024/03/13/261710315358.webp","The Gentlemen (TV Series)","The Gentlemen (TV Series) (2024)","Season 1. Episode 6. Eddie Horniman inherits a family estate, initially unaware its home to a drug empire run by a syndicate that has no plans to vacate. In this episode, Eddie's doubts about Susie continue to grow. But there's 15 million pounds of dirty money to be laundered before she'll consider leaving the estate. Created by Guy Ritchie.","Matt Platts-Mills","Callan Green","Matthieu Toullet","MALE | INTERIOR | FIGHT | KNOCKED OUT","Camera Roll | Overhead"
"https://asset.eyecannndy.com/media/clip/2024/02/11/261707687329.webp","Eternal Sunshine of the Spotless Mind","Eternal Sunshine of the Spotless Mind (2004)","When their relationship turns sour, a couple undergoes a medical procedure to have each other erased from their memories for ever.","Valdís Óskarsdóttir","Ellen Kuras","Kenny Becker","OVERHEAD | ICE","Overhead"
"https://asset.eyecannndy.com/media/clip/2024/01/04/261704383555.webp","Asteroid City","Asteroid City (2023)","Following a writer on his world famous fictional play about a grieving father who travels with his tech-obsessed family to small rural Asteroid City to compete in a junior stargazing event, only to have his world view disrupted forever.","Barney Pilling","Robert Yeoman","Gareth Spensley","WES ANDERSON | BLACK AND WHITE | SPOTLIGHT | SEPIA | 2.39 ANAMORPHIC | FILM 35MM | ZEISS MASTER ANAMORPHICS | COOKE S4/ I | ARRICAM LT | ARRICAM ST | STAGE","Overhead | Spotlight | Tilt"
"https://asset.eyecannndy.com/media/clip/2024/05/13/261715634117.webp","French Cassettes - White Noise","French Cassettes - White Noise (2024)","The music video for ""White Noise"" by French Cassettes, released in 2024, visually encapsulates themes of love, heartache, and self-discovery. It portrays the emotional complexities of relationships through a narrative of emotional turbulence and introspection, reflecting the aftermath of love and loss. The video enhances the song's lyrical exploration of finding solace amid emotional turmoil, using vibrant and expressive imagery to convey the depth of these experiences.","Syra McCarthy","Andy Hoffman","Roast n’ Post","RED | MALE | PANTS | CHECKERED | SWEATER","Overhead | Spotlight"
"https://asset.eyecannndy.com/media/clip/2023/12/24/261703454596.webp","Severance","Severance (2022)","Mark leads a team of office workers whose memories have been surgically divided between their work and personal lives. When a mysterious colleague appears outside of work, it begins a journey to discover the truth about their jobs.","Erica Freed Marker, Geoffrey Richman, Gershon Hinkson","Jessica Lee Gagné, Matt Mitchell, Suzie Lavelle","Company 3, Tom Poole","GREEN | CONFERENCE ROOM","Overhead | Tableau"
"https://asset.eyecannndy.com/media/clip/2024/03/10/261710030719.webp","The Gentlemen (TV Series)","The Gentlemen (TV Series) (2024)","Eddie Horniman inherits a family estate, initially unaware its home to a drug empire run by a syndicate that has no plans to vacate. Created by Guy Ritchie.","David Webb","Bjorn Charpentier, Ed Wild","","WEED | INTERIOR | MARIJUANA | SHRINK WRAP","Cut-ins | Overhead"
"https://asset.eyecannndy.com/media/clip/2023/12/20/261703046409.webp","X","X (2022)","In 1979, a group of young filmmakers set out to make an adult film in rural Texas, but when their reclusive, elderly hosts catch them in the act, the cast find themselves fighting for their lives.","David Kashevaroff (Editor)","Eliot Rockett","Damian McDonnell","X (2022) | DAY | WHITE | WOMAN | NATURE | FACE | EXTERIOR | LAKE | RIVER | ANAMORPHIC | 2020S | DIGITAL | X | DAMIAN MCDONNELL | HAWK LENS | ELIOT ROCKETT | SONY VENICE | TI WEST | DAVID KASHEVAROFF | FLOATING","Close-Up | Overhead"
"https://asset.eyecannndy.com/media/clip/2024/02/04/261707024039.webp","Everything Everywhere All at Once","Everything Everywhere All at Once (2022)","A middle-aged Chinese immigrant is swept up into an insane adventure in which she alone can save existence by exploring other universes and connecting with the lives she could have led.","Paul Rogers","Larkin Seiple","Alex Bickel","","Overhead | Overhead Close-up"
"https://asset.eyecannndy.com/media/clip/2024/02/14/261707899689.webp","Better Call Saul (TV Series)","Better Call Saul (TV Series) (2015)","The trials and tribulations of criminal lawyer Jimmy McGill in the years leading up to his fateful run-in with Walter White and Jesse Pinkman.","Skip Macdonald","Arthur Albert","Ted Brady","DAY | MALE | INTERIOR | PRISON","Overhead"
"https://asset.eyecannndy.com/media/clip/2024/02/11/261707632467.webp","The French Dispatch","The French Dispatch (2021)","A love letter to journalists set in an outpost of an American newspaper in a fictional twentieth century French city that brings to life a collection of stories published in ""The French Dispatch Magazine"".","Andrew Weisblum","Robert Yeoman","Gareth Spensley","BLACK AND WHITE | BEDROOM","1960s | Overhead | Two Shot"
"https://asset.eyecannndy.com/media/clip/2024/01/25/261706172805.webp","Huggies - Welcome to the World, Baby","Huggies - Welcome to the World, Baby (2021)","Huggies - Welcome to the World, Baby (2021)","Stewart Reeves, Trish Fuller","","Company 3, Sofie Borup","SUPER ZOOM | BABY | EARTH","Fourth Wall | Overhead | Super Zoom"
"https://asset.eyecannndy.com/media/clip/2024/01/30/261706588198.webp","Breaking Bad (TV Series)","Breaking Bad (TV Series) (2011)","Breaking Bad (TV Series) (2011)","Michael Slovis","","","RED | BLOOD | LAB | BOOTS | DEAD","Overhead"
"https://asset.eyecannndy.com/media/clip/2024/03/13/261710317062.webp","Skims - Lab","Skims - Lab (2024)","2024 advert for Kim Kardashian's Skims shapewear line, which aired during the pre-show coverage of the Academy Awards. The ad features a striking scene of Kim Kardashian observing numerous versions of herself on a series of video monitors, effectively embodying the essence and irony of modern celebrity culture.","Rory Mclame","Eric Yue","Ayumi Ashley","WOMAN | WALKING | KIM KARDASHIAN | SKIMS","Overhead | Overhead Tracking"
"https://asset.eyecannndy.com/media/clip/2024/02/11/261707645613.webp","The Departed","The Departed (2006)","An undercover cop and a mole in the police attempt to identify each other while infiltrating an Irish gang in South Boston.","Thelma Schoonmaker","Michael Ballhaus","Stephen Nakamura","INTERIOR | JAIL | PRISON | PRISONERS | CELL","Overhead"
"https://asset.eyecannndy.com/media/clip/2024/02/18/261708247642.webp","Sex Education (TV Series)","Sex Education (TV Series) (2019)","A teenage boy with a sex therapist mother teams up with a high school classmate to set up an underground sex therapy clinic at school.","David Webb, Steve Ackroyd","Jamie Cairney, Oli Russell","","INTERIOR | POOL SIDE","Overhead | Two Shot"
"https://asset.eyecannndy.com/media/clip/2024/01/24/261706084581.webp","2001: A Space Odyssey","2001: A Space Odyssey (1968)","After uncovering a mysterious artifact buried beneath the Lunar surface, a spacecraft is sent to Jupiter to find its origins: a spacecraft manned by two men and the supercomputer HAL 9000.","Ray Lovejoy","Geoffrey Unsworth, John Alcott","","INTERIOR | SPACESUIT | COCKPIT | OUTERSPACE | BUTTONS | SPACESHIT","Future | Overhead"
"https://asset.eyecannndy.com/media/clip/2024/02/11/261707628680.webp","Drake, 21 Savage - Spin Bout U","Drake, 21 Savage - Spin Bout U (2023)","2023 music video in collaboration between Drake and 21 Savage, directed by the iconic Dave Meyers.","Nathan Rodgers","Scott Cunningham","Stefan Sonnenfeld","NIGHT | EXTERIOR | YACHT","Overhead | Overhead Birds-Eye"
"https://asset.eyecannndy.com/media/clip/2024/01/04/261704384900.webp","Asteroid City","Asteroid City (2023)","Following a writer on his world famous fictional play about a grieving father who travels with his tech-obsessed family to small rural Asteroid City to compete in a junior stargazing event, only to have his world view disrupted forever.","Barney Pilling","Robert Yeoman","Gareth Spensley","DAY | WES ANDERSON | EXTERIOR | SATURATED | 2.39 ANAMORPHIC | FILM 35MM | ZEISS MASTER ANAMORPHICS | COOKE S4/ I | DESERT | ARRICAM LT | ARRICAM ST | CYAN","Color Shift | Overhead | Zoom out"
"https://asset.eyecannndy.com/media/clip/2024/01/29/261706567319.webp","The Grand Budapest Hotel","The Grand Budapest Hotel (2014)","A visually stunning and comedic masterpiece set in an eccentric Eastern European hotel.","Barney Pilling","Robert Yeoman","Jill Bogdanowicz","CAR | PINK | EXTERIOR | ROOF | VEHICLE | TOP","Overhead"
"https://asset.eyecannndy.com/media/clip/2024/02/27/261709017604.webp","Sheck Wes, JID & Ski Mask The Slump God - Fly Away","Sheck Wes, JID & Ski Mask The Slump God - Fly Away (2024)","Sheck Wes, JID & Ski Mask The Slump God - Fly Away (2024)","Cole Bennett","Franklin Ricart","Josh Bohoskey","DAY | MALE | EXTERIOR | DESERT | ALL IS YELLOW","Overhead | Shadows"
"https://asset.eyecannndy.com/media/clip/2024/02/18/261708237006.webp","YUNGBLUD - When We Die [feat. Lil Yachty]","YUNGBLUD - When We Die [feat. Lil Yachty] (2024)","2024 music video for artist YUNGBLUD, featuring Lil Yachty. Directed by Yussef Haridy and Logan Fields. Produced by Parallel Studios.","Logan Fields, Yussef Haridy","Zayd Ezzeldine","Dylan Hageman","MALE | INTERIOR | STAIRS","Overhead"
"https://asset.eyecannndy.com/media/clip/2024/02/27/261709020374.webp","Snipes x Nike - The Cypher","Snipes x Nike - The Cypher (2023)","Snipes x Nike - The Cypher (2023)","Alexis Benot, Eugène Signoret","Cesar Decharme","Arthur Paux","GROUP | DANCE | CYPHER","Echo print | Motion Blur | Overhead"
"https://asset.eyecannndy.com/media/clip/2024/02/27/261709017655.webp","Sheck Wes, JID & Ski Mask The Slump God - Fly Away","Sheck Wes, JID & Ski Mask The Slump God - Fly Away (2024)","Sheck Wes, JID & Ski Mask The Slump God - Fly Away (2024)","Cole Bennett","Franklin Ricart","Josh Bohoskey","DAY | MALE | EXTERIOR | DESERT | ALL IS YELLOW","Overhead | Shadows"
"https://asset.eyecannndy.com/media/clip/2024/02/04/261707021703.webp","Downtown Kayoto - Changed it","Downtown Kayoto - Changed it (2023)","Downtown Kayoto - Changed it (2023)","Joe Howat","","","WATER | GOLDFISH | BATHTUB | SINGLE SHOT","Close-Up | Overhead"
"https://asset.eyecannndy.com/media/clip/2023/12/23/261703367033.webp","Husky - Never-ever","Husky - Never-ever (2020)","A guy works as a janitor and cleans up gang fight scenes.","Kirill Khandurin","Kirill Groshev","","YELLOW | WARM | INTERIOR | DARK | ORANGE | OVERHEAD","Feedback | Overhead"
"https://asset.eyecannndy.com/media/clip/2024/02/11/261707684190.webp","New York, New York","New York, New York (1997)","An egotistical saxophonist and a young lounge singer meet on VJ Day and embark upon a strained and rocky romance, even as their careers begin a long, uphill climb.","Bert Lovitt, David Ramirez, Marcia Lucas, Tom Rolf","László Kovács","","INTERIOR","Overhead"
