video_url,alt_text,title,description,director,dop,colorist,tags,technique_tags
"https://asset.eyecannndy.com/media/clip/2024/02/27/261709017498.webp","Sheck Wes, JID & Ski Mask The Slump God - Fly Away","Sheck Wes, JID & Ski Mask The Slump God - Fly Away (2024)","Sheck Wes, JID & Ski Mask The Slump God - Fly Away (2024)","Cole Bennett","Franklin Ricart","Josh Bohoskey","DAY | MALE | EXTERIOR | DESERT | ALL IS YELLOW","Overhead"
"https://asset.eyecannndy.com/media/clip/2024/01/15/261705291377.webp","Kevin McGloughlin for Max Cooper 'Repetition'","Kevin McGloughlin for Max Cooper 'Repetition'","Kevin McGloughlin for Max Cooper 'Repetition'","Kevin McGloughlin","","","DAY | ROAD | WALKING | EXTERIOR | STREET | CROSSWALK","Overhead"
"https://asset.eyecannndy.com/media/clip/2024/02/11/261707645965.webp","The Aviator","The Aviator (2004)","A biopic depicting the early years of legendary director and aviator Howard Hughes' career from the late 1920s to the mid 1940s.","Thelma Schoonmaker","Robert Richardson","Stephen Nakamura","INTERIOR | BATHROOM | SINK | WASH","Overhead"
"https://asset.eyecannndy.com/media/clip/2024/02/14/261707899821.webp","Artist: Arturo Carrillo Herrera / IG","Artist: Arturo Carrillo Herrera / IG","Artist: Arturo Carrillo Herrera / IG","","","","BOXING","Overhead"
"https://asset.eyecannndy.com/media/clip/2024/01/25/261706172970.webp","Huggies - Welcome to the World, Baby","Huggies - Welcome to the World, Baby (2021)","Huggies - Welcome to the World, Baby (2021)","Stewart Reeves, Trish Fuller","","Company 3, Sofie Borup","DAY | INTERIOR | BABY | ROOM","Overhead"
"https://asset.eyecannndy.com/media/clip/2024/02/11/261707645749.webp","The King of Comedy","The King of Comedy (1982)","A passionate yet unsuccessful comedian stalks and kidnaps his idol to take the spotlight for himself.","Thelma Schoonmaker","Fred Schuler","","INTERIOR | TAPE | CAPTIVE","Overhead"
"https://asset.eyecannndy.com/media/clip/2024/01/06/261704527325.webp","Vertigo","Vertigo (1958)","A former San Francisco police detective juggles wrestling with his personal demons and becoming obsessed with the hauntingly beautiful woman he has been hired to trail, who may be deeply disturbed.","George Tomasini","Robert Burks","Richard Mueller","INTERIOR | 1950S | STAIRS | OVERHEAD | VISTA VISION","1950s | Dolly Zoom | Overhead"
"https://asset.eyecannndy.com/media/clip/2024/02/14/261707900299.webp","She's Gotta Have It","She's Gotta Have It (1986)","Story of a woman and her three lovers.","Spike Lee","Ernest R. Dickerson","Dave Pultz","BLACK AND WHITE","Overhead"
"https://asset.eyecannndy.com/media/clip/2024/01/30/261706588927.webp","Casper - Reviews","Casper - Reviews (2019)","2019 advert for Casper mattresses, featuring a great use of frame division.","","","","WARM | INTERIOR | BED | MATTRESS","Frame Division | Overhead"
"https://asset.eyecannndy.com/media/clip/2024/03/24/261711253654.webp","Coach - Life Has Different Paths","Coach - Life Has Different Paths (2024)","Coach - Life Has Different Paths (2024)","Nik Valentin","Pat Aldinger","Marina Starke","WALKING | INTERIOR | HALLWAY","Overhead | Overhead Tracking"
"https://asset.eyecannndy.com/media/clip/2024/02/28/261709095002.webp","Beethoven","Beethoven (1992)","A slobbering St. Bernard becomes the center of attention for a loving family, but must contend with a dog-napping veterinarian and his henchmen. Suggested by a brilliant Creative Director.","Sheldon Kahn, William D. Gordean","Victor J. Kemper","","INTERIOR | DINNER | DINING TABLE","Overhead"
"https://asset.eyecannndy.com/media/clip/2024/09/10/261725946196.webp","Sabrina Carpenter Ft. Jenna Ortega - Taste","Sabrina Carpenter Ft. Jenna Ortega - Taste (2024)","In Sabrina Carpenter's music video for ""Taste,"" co-starring Jenna Ortega, the duo engage in a gory, darkly comedic rivalry over a two-timing boyfriend. Directed by Dave Meyers, the video features numerous campy horror and cult film references, including scenes inspired by Death Becomes Her and Kill Bill. Carpenter and Ortega repeatedly murder each other in elaborate ways, including stabbings, voodoo dolls, and falls from great heights, only to make up with a kiss. In collaboration with Jacobi Mehringer, Anna Arnell, and Lizzy Walker.","Emile Doucette","Scott Cunningham","Dante Pasquinelli, ETHOS","BLOOD | HORROR | FENCE | GORE | SABRINA CARPENTER | SLASHER | IMPALED","Horror | Overhead"
"https://asset.eyecannndy.com/media/clip/2023/12/23/261703365874.webp","Husky - Never-ever","Husky - Never-ever (2020)","A guy works as a janitor and cleans up gang fight scenes. Zoom close up to ultra wide","Kirill Khandurin","Kirill Groshev","","YELLOW | WARM | INTERIOR | DARK | ORANGE | OVERHEAD","Overhead"
"https://asset.eyecannndy.com/media/clip/2024/02/14/261707900633.webp","The Matrix","The Matrix (1999)","When a beautiful stranger leads computer hacker Neo to a forbidding underworld, he discovers the shocking truth--the life he knows is the elaborate deception of an evil cyber-intelligence.","Zach Staenberg","Bill Pope","David Orr","INTERIOR | KEANU REEVES | SLEEPING","1990s | Overhead"
"https://asset.eyecannndy.com/media/clip/2024/03/01/261709332005.webp","Manga Saint Hilare, MoreNight - Alarm Bells (Feat. P Money & JME)","Manga Saint Hilare, MoreNight - Alarm Bells (Feat. P Money & JME) (2024)","Manga Saint Hilare, MoreNight - Alarm Bells (Feat. P Money & JME) (2024)","Will Norman","Melchiorre Ruvolo","Juliette Wileman","BLACK AND WHITE | TEETH","Object Portal | Overhead"
"https://asset.eyecannndy.com/media/clip/2024/01/04/261704342016.webp","Elderbrook - Why Do We Shake In The Cold?","Elderbrook - Why Do We Shake In The Cold? (2020)","Elderbrook - Why Do We Shake In The Cold? (2020)","Katarina Gramatová","Filip Marek","","DAY | INTERIOR | LARGE ROOM","Light Flash | Overhead"
"https://asset.eyecannndy.com/media/clip/2024/01/29/261706566828.webp","The French Dispatch","The French Dispatch (2021)","A love letter to journalists set in an outpost of an American newspaper in a fictional twentieth century French city that brings to life a collection of stories published in ""The French Dispatch Magazine"".","Andrew Weisblum","Robert Yeoman","Gareth Spensley","INTERIOR | DARK | STAIRS","Overhead"
"https://asset.eyecannndy.com/media/clip/2024/01/15/261705288057.webp","Squarespace - The Singularity","Squarespace - The Singularity (2023)","Squarespace's award-winning Super Bowl commercial, directed by Aoife McArdle and featuring Adam Driver. In the commercial, actor Adam Driver ponders the infinite possibilities of a website selling websites.","Dan Sherwen","Khalid Mohtaseb","George Kyriacou","DUSK | EXTERIOR | DESERT | ADAM DRIVER | ECLIPSE","Duplication | Overhead"
"https://asset.eyecannndy.com/media/clip/2024/02/11/261707642913.webp","Unknown source","Unknown source","Know the source? Email jacobi@eycndy.com","","","","MALE | INTERIOR | TABLE","Overhead"
"https://asset.eyecannndy.com/media/clip/2024/01/30/261706589089.webp","Casper - Reviews","Casper - Reviews (2019)","2019 advert for Casper mattresses, featuring a great use of frame division.","","","","WARM | INTERIOR | BED | MATTRESS","Frame Division | Overhead"
"https://asset.eyecannndy.com/media/clip/2024/03/10/261710031709.webp","The Gentlemen (TV Series)","The Gentlemen (TV Series) (2024)","Eddie Horniman inherits a family estate, initially unaware its home to a drug empire run by a syndicate that has no plans to vacate. Created by Guy Ritchie.","David Webb","Bjorn Charpentier, Ed Wild","","YELLOW | FAST FOOD | RESTAURANT | FOOD | KEYS | ONION RINGS | MILKSHAKE | RECEIPT | PANCAKES","Overhead"
"https://asset.eyecannndy.com/media/clip/2024/01/29/261706566095.webp","The French Dispatch","The French Dispatch (2021)","A love letter to journalists set in an outpost of an American newspaper in a fictional twentieth century French city that brings to life a collection of stories published in ""The French Dispatch Magazine"".","Andrew Weisblum","Robert Yeoman","Gareth Spensley","BLACK AND WHITE","1960s | Cross Dissolve | Overhead | Overhead Close-up | Vintage Graphics"
"https://asset.eyecannndy.com/media/clip/2024/01/29/261706572512.webp","Unbroken","Unbroken (2014)","After a near-fatal plane crash in WWII, Olympian Louis Zamperini spends a harrowing 47 days in a raft with two fellow crewmen before he's caught by the Japanese navy and sent to a prisoner-of-war camp.","Tim Squyres, William Goldenberg","Roger Deakins","Mitch Paulson","","Overhead | Shadows"
"https://asset.eyecannndy.com/media/clip/2023/12/25/261703489329.webp","Lil Yachty - TESLA","Lil Yachty - TESLA (2023)","Lil Yachty - TESLA (2023) Recipe: Overhead lazy susan Technique - Overhead Director - Cole Bennett DOP - Franklin Ricart Colorist - Loren White Original Source - Link GREEN PINK COLORFUL OVERHEAD SATURATED","Cole Bennett","Franklin Ricart","Loren White","GREEN | PINK | COLORFUL | OVERHEAD | SATURATED","Overhead"
"https://asset.eyecannndy.com/media/clip/2024/07/13/261720914600.webp","AJ Tracey - Bubble Bath","AJ Tracey - Bubble Bath (2024)","The music video for ""Bubble Bath"" by AJ Tracey, released in 2024, is set in a lively West London nail shop, directed by LateMilk. The video features vibrant, energetic scenes that reflect the song's upbeat and catchy vibe. It highlights the fusion of contemporary urban culture with playful, colorful visuals, showcasing AJ Tracey in various stylish setups, interacting with people in the nail shop, and performing the song with charisma and flair. The setting and visuals create a fun, engaging atmosphere that complements the track's infectious rhythm and lyrics.","LateMilk","Ethan Lodge","Andi Chu","CAR | NIGHT | MINIATURE | MODEL","Overhead | Overhead Tracking | Spotlight"
"https://asset.eyecannndy.com/media/clip/2023/12/24/261703407317.webp","Kendrick Lamar - Humble","Kendrick Lamar - Humble (2017)","The visually striking ""Humble"" music video, directed by Dave Meyer and reminiscent of Hype Williams' style, breathes life into Kendrick Lamar's ideas, setting the tone for his upcoming album, which appears to focus on his status as a superstar rather than a complex concept.","Greg Scruton","Scott Cunningham","Jaime O'Bradovich","CASH | KENDRICK LAMAR | COOL WHITE | MONEY GUN","Overhead"
"https://asset.eyecannndy.com/media/clip/2024/02/14/261707899764.webp","Unknown source","Unknown source","Know the source? Email jacobi@eycndy.com","","","","INTERIOR | TABLE | OVERHEAD","Overhead"
"https://asset.eyecannndy.com/media/clip/2024/02/11/261707683942.webp","The Age of Innocence","The Age of Innocence (1993)","A tale of nineteenth-century New York high society in which a young lawyer falls in love with a woman separated from her husband, while he is engaged to the woman's cousin.","Thelma Schoonmaker","Michael Ballhaus","","INTERIOR | DANCING | DANCE | BALLROOM","Overhead"
"https://asset.eyecannndy.com/media/clip/2024/02/14/261707898026.webp","The Menu","The Menu (2022)","A young couple travels to a remote island to eat at an exclusive restaurant where the chef has prepared a lavish menu, with some shocking surprises.","Christopher Tellefsen","Peter Deming","Ross Bartels","RESTAURANT | INTERIOR | OVERHEAD","Overhead"
"https://asset.eyecannndy.com/media/clip/2024/02/11/261707685829.webp","Gangs of New York","Gangs of New York (2002)","In 1862, Amsterdam Vallon returns to the Five Points area of New York City seeking revenge against Bill the Butcher, his father's killer.","Thelma Schoonmaker","Michael Ballhaus","","EXTERIOR | NEW YORK CITY","Overhead"
"https://asset.eyecannndy.com/media/clip/2024/02/04/261707019820.webp","The Metamorphosis of Birds","The Metamorphosis of Birds (2020)","The passing away of their mothers makes Catarina and her own father meet in an emotional place that is different from the one most fathers and daughters know.","Francisco Moreira","Paulo Menezes","","DAY | GREEN | FOREST | EXTERIOR | CHILD | BOY | OVERHEAD","Medium Close-up | Overhead"
"https://asset.eyecannndy.com/media/clip/2024/01/04/261704383819.webp","Asteroid City","Asteroid City (2023)","Following a writer on his world famous fictional play about a grieving father who travels with his tech-obsessed family to small rural Asteroid City to compete in a junior stargazing event, only to have his world view disrupted forever.","Barney Pilling","Robert Yeoman","Gareth Spensley","WES ANDERSON | TRAIN | TITLE | TYPOGRAPHY | SATURATED | 2.39 ANAMORPHIC | FILM 35MM | ZEISS MASTER ANAMORPHICS | COOKE S4/ I | ARRICAM LT | ARRICAM ST | CYAN | TITLE CARD | PANTONE | FONT","1950s | Credits | Overhead | Overhead Tracking"
"https://asset.eyecannndy.com/media/clip/2024/01/30/261706589142.webp","Casper - Reviews","Casper - Reviews (2019)","2019 advert for Casper mattresses, featuring a great use of frame division.","","","","WARM | INTERIOR | BED | MATTRESS","Frame Division | Match Cut | Overhead"
"https://asset.eyecannndy.com/media/clip/2024/03/01/261709333474.webp","Manga Saint Hilare, MoreNight - Alarm Bells (Feat. P Money & JME)","Manga Saint Hilare, MoreNight - Alarm Bells (Feat. P Money & JME) (2024)","Manga Saint Hilare, MoreNight - Alarm Bells (Feat. P Money & JME) (2024)","Will Norman","Melchiorre Ruvolo","Juliette Wileman","BLACK AND WHITE","Overhead"
"https://asset.eyecannndy.com/media/clip/2024/01/29/261706568194.webp","The Green Knight","The Green Knight (2021)","A fantasy retelling of the medieval story of Sir Gawain and the Green Knight.","David Lowery","Andrew Droz Palermo","Alastor Arnold","INTERIOR | BEDROOM | SLEEPING | GREEN KNIGHT | DEV PATEL","Middle Ages | Overhead"
"https://asset.eyecannndy.com/media/clip/2024/01/01/261704070327.webp","The Runaways","The Runaways (2010)","A coming-of-age biographical film about the 1970s teenage all-girl rock band The Runaways. The relationship between band members Cherie Currie and Joan Jett is also explored.","Richard Chew","Benoît Debie","Yvan Lucas","CIGARETTE | INTERIOR | SMOKING | FILM | BATH | OVERHEAD | 16MM | MUTED | ZEISS MASTER PRIME LENSES | ARRIFLEX 416 CAMERA | SUPER 16","Overhead"
"https://asset.eyecannndy.com/media/clip/2023/12/30/261703923431.webp","slowthai - Yum","slowthai - Yum (2023)","Shot breakdown: Overhead tracking shot","John Holloway","Jack Exton","","RED | WARM | OVERHEAD | SURREALISM","Magical realism | Overhead | Tracking"
"https://asset.eyecannndy.com/media/clip/2024/02/11/261707644803.webp","Taxi Driver","Taxi Driver (1976)","A mentally unstable veteran works as a nighttime taxi driver in New York City, where the perceived decadence and sleaze fuels his urge for violent action.","Melvin Shapiro, Tom Rolf","Michael Chapman","Company 3, Stefan Sonnenfeld","INTERIOR | GUN","Overhead"
"https://asset.eyecannndy.com/media/clip/2024/02/14/261707896091.webp","Better Call Saul (TV Series)","Better Call Saul (TV Series) (2015)","The trials and tribulations of criminal lawyer Jimmy McGill in the years leading up to his fateful run-in with Walter White and Jesse Pinkman.","Skip Macdonald","Arthur Albert","Ted Brady","DAY | MALE | EXTERIOR","Overhead"
"https://asset.eyecannndy.com/media/clip/2024/01/05/261704497146.webp","Young Sheldon (TV Series)","Young Sheldon (TV Series) (2017)","Meet a child genius named Sheldon Cooper (already seen as an adult in The Big Bang Theory (2007)) and his family. Some unique challenges face Sheldon, who is socially impaired.","Ben Bosse, Ione Soyangco","Buzz Feitshans IV","Frank Berrios, George Manno","ROAD | DRIVING | NIGHT | EXTERIOR | ARRI ALEXA MINI | ANGENIEUX OPTIMO | COOKE S4 PRIME","Dolly | Overhead"
"https://asset.eyecannndy.com/media/clip/2024/01/07/261704608980.webp","Carly Gibert - Dropping Seeds","Carly Gibert - Dropping Seeds (2023)","Carly Gibert - Dropping Seeds (2023)","Christopher A. Medina","Sonali Chugani","Ben Cerauli","GREEN | GRASS | FACE | CARLY GIBERT","Magical realism | Overhead"
"https://asset.eyecannndy.com/media/clip/2024/02/15/261707976200.webp","Dream Corp LLC","Dream Corp LLC (2016)","An absurd workplace comedy set in a neglected dream therapy facility where a rotating cast of desperate patients have their dreams recorded and analyzed by Dream Corp's absent-minded professor.","Daniel Stessen","","","WOMAN | RUNNING | STAIRS","Magical realism | Overhead | Rotoscope"
"https://asset.eyecannndy.com/media/clip/2023/12/19/261702950180.webp","Whiplash","Whiplash (2014)","""Whiplash"" is a 2014 film directed by Damien Chazelle, known for its intense portrayal of the relationship between a young jazz drummer and his demanding music instructor. Chazelle's dynamic direction in ""Whiplash"" earned him widespread acclaim, showcasing his ability to create tension and deliver a gripping narrative within the context of a music-driven story.","Tom Cross","Sharone Meir","Natasha Leonnet","WARM | INTERIOR | CONDUCTOR | J. K. SIMMONS | JAZZ | DRUMS","Overhead"
"https://asset.eyecannndy.com/media/clip/2024/01/29/261706567351.webp","The Grand Budapest Hotel","The Grand Budapest Hotel (2014)","A visually stunning and comedic masterpiece set in an eccentric Eastern European hotel.","Barney Pilling","Robert Yeoman","Jill Bogdanowicz","EXTERIOR | LOOKING UP","Central Framing | Overhead | Two Shot"
"https://asset.eyecannndy.com/media/clip/2024/03/01/261709331564.webp","Manga Saint Hilare, MoreNight - Alarm Bells (Feat. P Money & JME)","Manga Saint Hilare, MoreNight - Alarm Bells (Feat. P Money & JME) (2024)","Manga Saint Hilare, MoreNight - Alarm Bells (Feat. P Money & JME) (2024)","Will Norman","Melchiorre Ruvolo","Juliette Wileman","GREY | BLACK AND WHITE","Overhead | Spotlight | Void"
"https://asset.eyecannndy.com/media/clip/2024/02/11/261707683429.webp","Unknown Source","Unknown Source","Unknown Source Technique - Overhead , Overhead Tracking Director - Martin Scorsese","Martin Scorsese","","","","Overhead | Overhead Tracking"
"https://asset.eyecannndy.com/media/clip/2024/02/11/261707686568.webp","Source unknown","Source unknown","Know the source? Email jacobi@eycndy.com","Martin Scorsese","","","","Overhead | Overhead Tracking"
"https://asset.eyecannndy.com/media/clip/2024/02/11/261707686196.webp","The Wolf of Wall Street","The Wolf of Wall Street (2013)","Based on the true story of Jordan Belfort, from his rise to a wealthy stock-broker living the high life to his fall involving crime, corruption and the federal government.","Thelma Schoonmaker","Rodrigo Prieto","Yvan Lucas","","1980s | High Angle | Overhead | Overhead Tracking"
"https://asset.eyecannndy.com/media/clip/2024/03/13/261710331537.webp","Nike - Mad Ready (DC)","Nike - Mad Ready (DC) (2024)","Nike - Mad Ready (DC) (2024) Technique - Overhead Director - India Harris DOP - Konrad Losch Editor - Lorna Searl, Trim Editing Colorist - Tim Smith Original Source - Link INTERIOR APPLE FOOD LUNCH TRAY CAFETERIA","Lorna Searl, Trim Editing","Konrad Losch","Tim Smith","INTERIOR | APPLE | FOOD | LUNCH | TRAY | CAFETERIA","Overhead"
"https://asset.eyecannndy.com/media/clip/2023/12/24/261703454253.webp","Severance","Severance (2022)","Mark leads a team of office workers whose memories have been surgically divided between their work and personal lives. When a mysterious colleague appears outside of work, it begins a journey to discover the truth about their jobs.","Erica Freed Marker, Geoffrey Richman, Gershon Hinkson","Jessica Lee Gagné, Matt Mitchell, Suzie Lavelle","Company 3, Tom Poole","GREEN | INTERIOR | COOL | OVERHEAD","Overhead | Tableau"
"https://asset.eyecannndy.com/media/clip/2024/01/12/261705032132.webp","Unknown T - Hocus Pocus Feat. Loyle Carner","Unknown T - Hocus Pocus Feat. Loyle Carner (2023)","Unknown T - Hocus Pocus Feat. Loyle Carner (2023)","Fouad Gaber","Anna Smoroňová","Marina Starke","DAY | EXTERIOR | SWING SET | SWING","Fixed Cam | Overhead"
"https://asset.eyecannndy.com/media/clip/2024/03/05/261709635545.webp","Cowboy Bepop (TV Series)","Cowboy Bepop (TV Series) (2021)","A ragtag crew of bounty hunters chases down the galaxy's most dangerous criminals. They'll save the world--for the right price. Created by Christopher L. Yost.","Bridget Durnford, Elliot Greenberg","Dave Perkal, Jean-Philippe Gossart, Thomas Burstyn","Bill Ferwerda, Company 3","","Overhead | Pass Through | Seamless Transition | Transitions"
"https://asset.eyecannndy.com/media/clip/2024/02/11/261707642680.webp","Talk To Me","Talk To Me (2023)","When a group of friends discover how to conjure spirits using an embalmed hand, they become hooked on the new thrill, until one of them goes too far and unleashes terrifying supernatural forces. Close up > Whip roll","Geoff Lamb","Aaron McLisky","Marty Pepper","INTERIOR | BED","Happiness | Overhead | Two Shot"
"https://asset.eyecannndy.com/media/clip/2024/01/04/261704385361.webp","Asteroid City","Asteroid City (2023)","Following a writer on his world famous fictional play about a grieving father who travels with his tech-obsessed family to small rural Asteroid City to compete in a junior stargazing event, only to have his world view disrupted forever.","Barney Pilling","Robert Yeoman","Gareth Spensley","DAY | GOLD | WES ANDERSON | 2.39 ANAMORPHIC | FILM 35MM | ZEISS MASTER ANAMORPHICS | COOKE S4/ I | DESERT | ARRICAM LT | ARRICAM ST | CYAN","1950s | Overhead"
"https://asset.eyecannndy.com/media/clip/2024/03/01/261709333245.webp","Manga Saint Hilare, MoreNight - Alarm Bells (Feat. P Money & JME)","Manga Saint Hilare, MoreNight - Alarm Bells (Feat. P Money & JME) (2024)","Manga Saint Hilare, MoreNight - Alarm Bells (Feat. P Money & JME) (2024)","Will Norman","Melchiorre Ruvolo","Juliette Wileman","STUDIO | BLACK AND WHITE","Overhead | Spotlight | Void"
"https://asset.eyecannndy.com/media/clip/2024/02/14/261707899886.webp","She's Gotta Have It","She's Gotta Have It (1986)","Story of a woman and her three lovers.","Spike Lee","Ernest R. Dickerson","Dave Pultz","BLACK AND WHITE","Overhead | Two Shot"
"https://asset.eyecannndy.com/media/clip/2024/02/11/261707645424.webp","Goodfellas","Goodfellas (1990)","The story of Henry Hill and his life in the mafia, covering his relationship with his wife Karen and his mob partners Jimmy Conway and Tommy DeVito.","James Y. Kwei, Thelma Schoonmaker","Michael Ballhaus","","INTERIOR","Overhead | Slow Motion"
"https://asset.eyecannndy.com/media/clip/2024/02/08/261707404142.webp","Her Morning Elegance","Her Morning Elegance (2009)","A collaborative stop motion film by musician Oren Lavie and Israeli photographer Eyal Landesman. The only stop-motion video to ever earn a grammy nomination, this whimsical video accompanies the song of same name by Lavie. The camera remains stationary while bedroom linens and clothing move across the mattress as personifications of the birds, trains, and fish she dreams of.","Oren Lavie, Yuval and Merav Nathan","Eyal Landsman","","DAY | WOMAN | INTERIOR | BEDROOM | OVERHEAD","Overhead | Pixilation | Stop Motion"
"https://asset.eyecannndy.com/media/clip/2024/02/11/261707645872.webp","Bringing Out the Dead","Bringing Out the Dead (1999)","Haunted by the patients he failed to save, a monumentally burned-out Manhattan ambulance paramedic fights to maintain his sanity over three increasingly turbulent nights.","","","","WATER | INTERIOR | SINK | WASHING","Overhead"
"https://asset.eyecannndy.com/media/clip/2024/02/08/261707404368.webp","Her Morning Elegance","Her Morning Elegance (2009)","A collaborative stop motion film by musician Oren Lavie and Israeli photographer Eyal Landesman. The only stop-motion video to ever earn a grammy nomination, this whimsical video accompanies the song of same name by Lavie. The camera remains stationary while bedroom linens and clothing move across the mattress as personifications of the birds, trains, and fish she dreams of.","Oren Lavie, Yuval and Merav Nathan","Eyal Landsman","","DAY | WOMAN | INTERIOR | BEDROOM | OVERHEAD","Overhead | Pixilation | Stop Motion"
"https://asset.eyecannndy.com/media/clip/2024/01/15/261705291233.webp","Kevin McGloughlin for Max Cooper 'Repetition'","Kevin McGloughlin for Max Cooper 'Repetition'","Kevin McGloughlin for Max Cooper 'Repetition'","Kevin McGloughlin","","","WOMAN | INTERIOR | STAIRS | CONVEYOR | ONE SHOT | PERSON | ESCALATOR","Object Duplication | Overhead"
"https://asset.eyecannndy.com/media/clip/2024/01/06/261704528893.webp","Conswank - Holes In My Denim","Conswank - Holes In My Denim (2023)","Produced by Will Keeper Mixed/Mastered by John Wehmeyer Directed and Edited by Pat & Seamus Brennan Production Designer: Kayla Payette Production Assistant: Bastien Gliech Presented by Holy Smokes Entertainment","Pat & Seamus Brennan","","","INTERIOR | SINGLE SHOT | SITTING","Overhead"
"https://asset.eyecannndy.com/media/clip/2023/12/25/261703489876.webp","Lil Yachty - TESLA","Lil Yachty - TESLA (2023)","Recipe: Overhead duotone lazy susan","Cole Bennett","Franklin Ricart","Loren White","GREEN | PINK | INTERIOR | COLORFUL | OVERHEAD | SATURATED | SATURATION | DUOTONE","Lazy Susan | Overhead"
"https://asset.eyecannndy.com/media/clip/2024/01/13/261705177616.webp","Adidas - Feel the Boost","Adidas - Feel the Boost (2019)","2019 commercial for adidas from director and cinematographer Dani Abelló, featuring fast-paced ground-level running sequences throughout. Created by agency 72andSunny and produced by Somesuch and Anonymous. You're seeing an overhead fixed camera shot. Overhead doesn't always mean the shot is always high up, and this shot is classified as 'fixed camera' instead of tracking because the camera is fixed to the body. You might also consider this a 'first-person pov' as though one was looking down at their legs while running.","Dani Abelló","","","DAY | RUNNING | EXTERIOR | CITY","First-Person | Fixed Cam | Overhead"
