video_url,alt_text,title,description,director,dop,colorist,tags,technique_tags
"https://asset.eyecannndy.com/media/clip/2024/04/01/261711985649.webp","Travis Scott - FE!N","Travis Scott - FE!N (2024)","The music video for ""Fe!n"" by Travis Scott featuring Playboi Carti was released on March 30, 2024, on Scott's YouTube channel via Vevo and directed by Gabriel Moses. The song itself, part of Scott's album ""Utopia,"" has been praised for its unique composition and contributions from both artists, showcasing a new vocal delivery by Carti and Scott's titular chorus.","Joseph Taylor, Trim Editing","Xiaolong Liu","John Lowe","GROUP | OVERHEAD","Overhead | Speed warp | Spotlight | Void"
"https://asset.eyecannndy.com/media/clip/2024/02/11/261707684469.webp","Casino","Casino (1995)","In Las Vegas, two best friends - a casino executive and a mafia enforcer - compete for a gambling empire and a fast-living, fast-loving socialite.","Thelma Schoonmaker","Robert Richardson","John Gardiner","INTERIOR | CASINO","1990s | Overhead | Overhead Tracking"
"https://asset.eyecannndy.com/media/clip/2024/03/04/261709532127.webp","Monster: The Jeffrey Dahmer Story","Monster: The Jeffrey Dahmer Story (2022)","The story of a cannibalistic serial killer named Jeffrey Dahmer, a.k.a. the Milwaukee Monster.","Lyric Ramsey, Nicholas Emme, Peter Grabicki, Robin August","Jason McCormick, John T. Connor","Doug Delaney, Michael Hatzer","INTERIOR | BATHROOM | DAHMER | PILLS","1980s | Overhead | Overhead Close-up"
"https://asset.eyecannndy.com/media/clip/2024/02/18/261708243705.webp","YUNGBLUD - When We Die [feat. Lil Yachty]","YUNGBLUD - When We Die [feat. Lil Yachty] (2024)","2024 music video for artist YUNGBLUD, featuring Lil Yachty. Directed by Yussef Haridy and Logan Fields. Produced by Parallel Studios.","Logan Fields, Yussef Haridy","Zayd Ezzeldine","Dylan Hageman","DAY | MALE | EXTERIOR | TRIP | DRUG","Altered state | Drug trip | Falling | Overhead | Single shot"
"https://asset.eyecannndy.com/media/clip/2023/12/28/261703733687.webp","Jennifer's Body","Jennifer's Body (2009)","A newly-possessed high-school cheerleader turns into a succubus who specializes in killing her male classmates. Can her best friend put an end to the horror? Shot breakdown: Overhead slow motion. Shot breakdown: Wide overhead","Plummy Tucker","M. David Mullen","Mitch Paulson","DAY | INTERIOR | GREY | 35MM | SUPER 35 | PANAVISION PRIMO PRIMES | 3 PERF | PHANTOM HD GOLD | PANAVISION GOLD / G2","Overhead"
"https://asset.eyecannndy.com/media/clip/2024/02/19/261708335504.webp","AJR - Maybe Man","AJR - Maybe Man (2024)","An incredible brush-stroke style animation from Prime Render Studios; inspired by Miyazaki and a staple animation style of artist Bozo Balov. Illustrated in Quill VR. Animated in Blender.","Edoardo Ranaboldo","","","SKY | EXTERIOR","Oil Paint | Overhead | Overhead Birds-Eye | Transitions"
"https://asset.eyecannndy.com/media/clip/2024/02/14/261707902247.webp","Source unknown","Source unknown","Know the source? Email jacobi@eycndy.com","","","","DAY | EXTERIOR | BALL | TENNIS COURT","Overhead | Overhead Birds-Eye"
"https://asset.eyecannndy.com/media/clip/2024/03/05/261709635259.webp","Cowboy Bepop (TV Series)","Cowboy Bepop (TV Series) (2021)","A ragtag crew of bounty hunters chases down the galaxy's most dangerous criminals. They'll save the world--for the right price. Created by Christopher L. Yost.","Bridget Durnford, Elliot Greenberg","Dave Perkal, Jean-Philippe Gossart, Thomas Burstyn","Bill Ferwerda, Company 3","","Action | Overhead"
"https://asset.eyecannndy.com/media/clip/2023/12/24/261703388266.webp","Halfprice - Fitting room","Halfprice - Fitting room (2022)","Halfprice - Fitting room (2022)","Nikodem Chabior","Mikołaj Syguda","Florian Martiny","BLUE | INTERIOR | OVERHEAD | FASHION | CHANGING ROOM","Conveyor | Overhead"
"https://asset.eyecannndy.com/media/clip/2024/03/19/261710825914.webp","Dillon Francis, Good Times Ahead - LA On Acid","Dillon Francis, Good Times Ahead - LA On Acid (2023)","Dillon Francis, Good Times Ahead - LA On Acid (2023)","Jacob Ehrlich","Franklin Ricart","Josh Bohoskey","RESTAURANT | INTERIOR | TABLE","Camera Roll | Overhead"
"https://asset.eyecannndy.com/media/clip/2024/03/22/261711140750.webp","Downtown Kayoto - Came Thru","Downtown Kayoto - Came Thru (2024)","Downtown Kayoto - Came Thru (2024)","Joe Howat","Harry Basey","Anna Barsukova","VINTAGE | OVERHEAD | CAMERA | SINGLE-LENS REFLEX CAMERA","Cut-ins | Overhead | Overhead Close-up"
"https://asset.eyecannndy.com/media/clip/2024/02/27/261709018362.webp","Sheck Wes, JID & Ski Mask The Slump God - Fly Away","Sheck Wes, JID & Ski Mask The Slump God - Fly Away (2024)","Sheck Wes, JID & Ski Mask The Slump God - Fly Away (2024)","Cole Bennett","Franklin Ricart","Josh Bohoskey","NIGHT | EXTERIOR | ALL IS YELLOW","Overhead | Spotlight"
"https://asset.eyecannndy.com/media/clip/2024/01/13/261705106861.webp","Get Out","Get Out (2017)","A young African-American visits his white girlfriend's parents for the weekend, where his simmering uneasiness about their reception of him eventually reaches a boiling point.","Gregory Plotkin","Toby Oliver","Aidan Stanford","DARK | BLACK | JORDAN PEELE | VOID | SUNKEN PLACE | GET OUT | HYPNOSIS | HYPNOTIZE","Horror | Overhead | Void"
"https://asset.eyecannndy.com/media/clip/2024/01/29/261706566324.webp","The French Dispatch","The French Dispatch (2021)","A love letter to journalists set in an outpost of an American newspaper in a fictional twentieth century French city that brings to life a collection of stories published in ""The French Dispatch Magazine"".","Andrew Weisblum","Robert Yeoman","Gareth Spensley","WALKING | TYPOGRAPHY","1960s | First-Person | Overhead | Title Card"
"https://asset.eyecannndy.com/media/clip/2024/03/24/261711246026.webp","adidas - Original is Never Finished (Chapter 3)","adidas - Original is Never Finished (Chapter 3) (2017)","The third installment of adidas Originals' 'Original Is Never Finished' series, directed by Terence Neal.","Christopher Fetsch, Robert Lopuski","Alexis Zabe","Company 3, Tom Poole","SHIRTLESS | ICE BATH | JAMES HARDEN","Overhead | Slow Motion"
"https://asset.eyecannndy.com/media/clip/2024/02/28/261709103917.webp","Watchtower of Turkey","Watchtower of Turkey (2014)","Described as a visual masterpiece, ""Watchtower of Turkey"" is praised for its breathtaking cinematography, dynamic soundtrack, and impeccable editing. The film takes viewers through vibrant cities and awe-inspiring landscapes, showcasing the country's remarkable diversity and beauty. It's more than just a travel video; it's a tribute to Turkey's rich culture, history, and natural wonders, crafted with an eye for detail and a knack for storytelling.","Leonardo Dalessandri","","","INTERIOR | FLOWER | COOK","Overhead | Quick Cuts"
"https://asset.eyecannndy.com/media/CACHE/images/clip/2024/02/11/tumblr_8dc5b03c5337bd0653c36406b9dc17dd_e82218bd_500/c45dfe9fec9fbe98021c3673765497f4.gif","Enter the Void","Enter the Void (2009)","An American drug dealer living in Tokyo is betrayed by his best friend and killed in a drug deal. His soul, observing the repercussions of his death, seeks resurrection.","Jérôme Pesnel, Marc Boucrot","Benoît Debie","","EXTERIOR","2000s | Altered state | Drug trip | Overhead Birds-Eye"
"https://asset.eyecannndy.com/media/clip/2024/01/21/261705822726.webp","Kevin McGloughlin for Max Cooper 'Repetition'","Kevin McGloughlin for Max Cooper 'Repetition' (2019)","'Repetition' is an attempt to convey the importance of our endless endeavours toward human development and growth amidst a chaotic and disorienting landscape. The struggle for a fruitful future is challenging with the distractions of everyday life alongside its ever-growing technological 'advancements'. The hope is for humanity to strive through all of this in a meaningful and positive way.","Kevin McGloughlin","","","ROAD | DRIVING | BRIDGE | EXTERIOR | OVERHEAD | VEHICLE | CARS | HIGHWAY | ASPHALT | CEMENT | OVERPASS","Object Duplication | Overhead Birds-Eye"
"https://asset.eyecannndy.com/media/clip/2023/12/20/261703062943.webp","Source Unknown","Source Unknown","Know the source? Email jacobi@eyecandy.com","","","","","Extreme Wide | FPV Drone | Overhead Birds-Eye"
"https://asset.eyecannndy.com/media/clip/2023/12/22/261703283796.webp","Animation by Artist, Invisible World","Animation by Artist, Invisible World (2023)","Infinite zoom surrealist transition from macro of quarter to overhead shot of city","Invisible World","","","MACRO | OVERHEAD | QUARTER","Overhead Birds-Eye | Super Zoom"
"https://asset.eyecannndy.com/media/CACHE/images/clip/2023/12/20/tumblr_20ed0982af52f2c1386772531d6a979d_94ebfbed_540/a38faab349428b0f901a1bb91012ebef.gif","X","X (2022)","In 1979, a group of young filmmakers set out to make an adult film in rural Texas, but when their reclusive, elderly hosts catch them in the act, the cast find themselves fighting for their lives.","David Kashevaroff (Editor)","Eliot Rockett","Damian McDonnell","X (2022) | DAY | WATER | GREEN | NATURE | EXTERIOR | LAKE | EXTREME WIDE | OVERHEAD | RIVER | ANAMORPHIC | 2020S | DIGITAL | X | DAMIAN MCDONNELL | HAWK LENS | ELIOT ROCKETT | SONY VENICE | TI WEST | DAVID KASHEVAROFF | BIRDS-EYE","Extreme Wide | FPV Drone | Overhead Birds-Eye"
"https://asset.eyecannndy.com/media/clip/2023/12/20/261703046284.webp","X","X (2022)","In 1979, a group of young filmmakers set out to make an adult film in rural Texas, but when their reclusive, elderly hosts catch them in the act, the cast find themselves fighting for their lives.","David Kashevaroff (Editor)","Eliot Rockett","Damian McDonnell","X (2022) | DAY | WATER | GREEN | NATURE | EXTERIOR | LAKE | EXTREME WIDE | OVERHEAD | RIVER | ANAMORPHIC | 2020S | DIGITAL | X | DAMIAN MCDONNELL | HAWK LENS | ELIOT ROCKETT | SONY VENICE | TI WEST | DAVID KASHEVAROFF | BIRDS-EYE","1970s | Extreme Wide | FPV Drone | Overhead Birds-Eye"
"https://asset.eyecannndy.com/media/CACHE/images/clip/2024/02/11/Lil_Uzi_Vert_-_Just_Wanna_Rock_Official_Music_Video_CnLAV4e/c82554a93a35180510946909d55d9487.gif","Lil Uzi Vert - Just Wanna Rock","Lil Uzi Vert - Just Wanna Rock (2022)","2022 music video for Lil Uzi Vert from renowned artist, Gibson Hazard. Produced in collaboration between House of Hazard and ShotClock. Visual effects from Black Hat VFX.","Chris Villa, Kenny Shimm (Editor)","Cory Burmester","Josh Bohoskey, Matt Osborne","NIGHT | EXTERIOR | CITY | CROWD","Overhead Birds-Eye"
"https://asset.eyecannndy.com/media/clip/2024/02/11/261707632272.webp","Unlocked","Unlocked (2023)","A woman's life is turned upside-down when a dangerous man gets hold of her lost cell phone and uses it to track her every move.","Kim Tae Joon","","","DAY | WALKING | EXTERIOR | CITY | CROWD | PEOPLE","Overhead Birds-Eye | Slow Motion"
"https://asset.eyecannndy.com/media/clip/2024/01/21/261705822931.webp","Kevin McGloughlin for Max Cooper 'Repetition'","Kevin McGloughlin for Max Cooper 'Repetition' (2019)","'Repetition' is an attempt to convey the importance of our endless endeavours toward human development and growth amidst a chaotic and disorienting landscape. The struggle for a fruitful future is challenging with the distractions of everyday life alongside its ever-growing technological 'advancements'. The hope is for humanity to strive through all of this in a meaningful and positive way.","Kevin McGloughlin","","","DAY | EXTERIOR | CARS | HIGHWAY | ROADS | ASPHALT | VEHICLES","Object Duplication | Overhead Birds-Eye"
"https://asset.eyecannndy.com/media/clip/2024/01/21/261705822962.webp","Kevin McGloughlin for Max Cooper 'Repetition'","Kevin McGloughlin for Max Cooper 'Repetition' (2019)","'Repetition' is an attempt to convey the importance of our endless endeavours toward human development and growth amidst a chaotic and disorienting landscape. The struggle for a fruitful future is challenging with the distractions of everyday life alongside its ever-growing technological 'advancements'. The hope is for humanity to strive through all of this in a meaningful and positive way.","Kevin McGloughlin","","","DAY | EXTERIOR | CARS | HIGHWAY | ROADS | ASPHALT | VEHICLES","Object Duplication | Overhead Birds-Eye"
"https://asset.eyecannndy.com/media/clip/2024/02/11/261707644136.webp","Silence","Silence (2016)","In the 17th century, two Portuguese Jesuit priests travel to Japan in an attempt to locate their mentor, who is rumored to have committed apostasy, and to propagate Catholicism.","Thelma Schoonmaker","Rodrigo Prieto","Tim Stipan","WALKING | EXTERIOR","Overhead Birds-Eye"
"https://asset.eyecannndy.com/media/clip/2023/12/25/261703479717.webp","Nike - The Ball Makes Us More","Nike - The Ball Makes Us More (2018)","Nike - The Ball Makes Us More (2018)","Wally Pfister","","Daniel De Vue","SPORTS | SOCCER | JERSEY","Frame Division | Overhead Birds-Eye"
"https://asset.eyecannndy.com/media/clip/2024/01/06/261704508902.webp","Clip from Mikhail Parkhomenko","Clip from Mikhail Parkhomenko","Shot: Birds-eye overhead with subtle pull out.","Mikhail Parkhomenko (parh0)","","","DRIVING | EXTERIOR | CARS | HIGHWAY | ROADS | ASPHALT","Overhead Birds-Eye"
"https://asset.eyecannndy.com/media/clip/2023/12/23/261703310892.webp","Flash cut animation by Kevin McGloughlin","Flash cut animation by Kevin McGloughlin","Flash cut animation by Kevin McGloughlin","Fabio Gargano","","","DAY | EXTERIOR | EARTH | BIRDS-EYE | CROP | FARMLAND","Flash Cut | Overhead Birds-Eye"
"https://asset.eyecannndy.com/media/clip/2024/02/14/261707901758.webp","Zodiac","Zodiac (2007)","Between 1968 and 1983, a San Francisco cartoonist becomes an amateur detective obsessed with tracking down the Zodiac Killer, an unidentified individual who terrorizes Northern California with a killing spree.","Angus Wall","Harris Savides","Stephen Nakamura","CAR | ROAD | DRIVING | EXTERIOR | VEHICLE","Locked-On | Overhead Birds-Eye"
"https://asset.eyecannndy.com/media/clip/2024/03/12/261710224130.webp","The Gentlemen (TV Series)","The Gentlemen (TV Series) (2024)","Season 1. Episode 4. Eddie Horniman inherits a family estate, initially unaware its home to a drug empire run by a syndicate that has no plans to vacate. Created by Guy Ritchie.","Dan Sherwen, Matt Platts-Mills","Bjorn Charpentier","Matthieu Toullet","DAY | GREEN | GRASS | EXTERIOR | SAD | FUNERAL","Overhead Birds-Eye | Sadness"
"https://asset.eyecannndy.com/media/clip/2024/03/12/261710224045.webp","The Gentlemen (TV Series)","The Gentlemen (TV Series) (2024)","Season 1. Episode 4. Eddie Horniman inherits a family estate, initially unaware its home to a drug empire run by a syndicate that has no plans to vacate. Created by Guy Ritchie.","Dan Sherwen, Matt Platts-Mills","Bjorn Charpentier","Matthieu Toullet","EXPLOSION | LAKE | BOAT | FISHING","Overhead Birds-Eye"
"https://asset.eyecannndy.com/media/clip/2024/01/09/261704835059.webp","Nike - Nothing Beats a Londoner","Nike - Nothing Beats a Londoner (2018)","Energetic and competitive, London's youth, portrayed in Nike's now iconic commercial showcase their city and sporting prowess, inspired by local icons.","Joe Guest","Nicolas Loir","","AERIAL | MESSI | OVERHEAD BIRDS EYE","Aerial | Magical realism | Overhead Birds-Eye | Tilt"
"https://asset.eyecannndy.com/media/clip/2024/01/21/261705822873.webp","Kevin McGloughlin for Max Cooper 'Repetition'","Kevin McGloughlin for Max Cooper 'Repetition' (2019)","'Repetition' is an attempt to convey the importance of our endless endeavours toward human development and growth amidst a chaotic and disorienting landscape. The struggle for a fruitful future is challenging with the distractions of everyday life alongside its ever-growing technological 'advancements'. The hope is for humanity to strive through all of this in a meaningful and positive way.","Kevin McGloughlin","","","NIGHT | DARK | SODIUM | CARS | HIGHWAY | ROADS | ASPHALT | VEHICLES","Object Duplication | Overhead Birds-Eye"
"https://asset.eyecannndy.com/media/clip/2024/01/04/261704369836.webp","IG / @the.vantage.point","IG / @the.vantage.point","IG / @the.vantage.point Technique - Aerial , Overhead Birds-Eye OVERHEAD","","","","OVERHEAD","Aerial | Overhead Birds-Eye"
"https://asset.eyecannndy.com/media/clip/2024/03/12/261710223877.webp","The Gentlemen (TV Series)","The Gentlemen (TV Series) (2024)","Season 1. Episode 4. Eddie Horniman inherits a family estate, initially unaware its home to a drug empire run by a syndicate that has no plans to vacate. Created by Guy Ritchie.","Dan Sherwen, Matt Platts-Mills","Bjorn Charpentier","Matthieu Toullet","EXTERIOR | CASTLE | DEAD","Hand-drawn | Intertitles | Overhead Birds-Eye"
"https://asset.eyecannndy.com/media/clip/2023/12/23/261703310799.webp","Flash cut animation by Kevin McGloughlin","Flash cut animation by Kevin McGloughlin","Flash cut animation by Kevin McGloughlin","Fabio Gargano","","","DAY | EXTERIOR | EARTH | BIRDS-EYE | CROP | FARMLAND","Flash Cut | Overhead Birds-Eye"
"https://asset.eyecannndy.com/media/CACHE/images/clip/2024/02/28/watchtower_of_turkey_1080p_4jIBPKL/012567949738d034106851d6a912811c.gif","Watchtower of Turkey","Watchtower of Turkey (2014)","Described as a visual masterpiece, ""Watchtower of Turkey"" is praised for its breathtaking cinematography, dynamic soundtrack, and impeccable editing. The film takes viewers through vibrant cities and awe-inspiring landscapes, showcasing the country's remarkable diversity and beauty. It's more than just a travel video; it's a tribute to Turkey's rich culture, history, and natural wonders, crafted with an eye for detail and a knack for storytelling.","Leonardo Dalessandri","","","BEACH | RUNNING | FEET","Motion Blur | Overhead Close-up"
"https://asset.eyecannndy.com/media/clip/2023/12/23/261703366569.webp","Husky - Never-ever","Husky - Never-ever (2020)","A guy works as a janitor and cleans up gang fight scenes.","Kirill Khandurin","Kirill Groshev","","YELLOW | WARM | INTERIOR | DARK | ORANGE | OVERHEAD","Overhead Close-up"
"https://asset.eyecannndy.com/media/clip/2024/02/11/261707683594.webp","The Wolf of Wall Street","The Wolf of Wall Street (2013)","Based on the true story of Jordan Belfort, from his rise to a wealthy stock-broker living the high life to his fall involving crime, corruption and the federal government.","Thelma Schoonmaker","Rodrigo Prieto","Yvan Lucas","INTERIOR | PHONE | CALL | LEO DICAPRIO","1980s | Overhead Close-up"
"https://asset.eyecannndy.com/media/clip/2024/01/10/261704863436.webp","Lazy Susan","Lazy Susan (2019)","You might be one of the millions of people whose life was made a little bit easier by Susan and you don’t even know it. Shot breakdown: Overhead tracking shot.","Terri Timely","Donavan Sell","Clinton Homuth","MUSIC | INTERIOR | OVERHEAD | RECORD PLAYER","Locked-On | Overhead Close-up"
"https://asset.eyecannndy.com/media/clip/2024/01/06/261704508223.webp","Clip from Mikhail Parkhomenko","Clip from Mikhail Parkhomenko","Clip from Mikhail Parkhomenko Technique - Droste Effect , Overhead Close-up Director - Mikhail Parkhomenko (parh0) DUPLICATION INSTAGRAM IPHONE CLONING","Mikhail Parkhomenko (parh0)","","","DUPLICATION | INSTAGRAM | IPHONE | CLONING","Droste Effect | Overhead Close-up"
"https://asset.eyecannndy.com/media/clip/2023/12/29/261703843473.webp","Death Proof","Death Proof (2007)","Two separate sets of voluptuous women are stalked at different times by a scarred stuntman who uses his ""death proof"" cars to execute his murderous plans.","Sally Menke","","Steve Sheridan","DAY | 35MM | 2000S | ARRIFLEX 435 | 3 PERF | PANAVISION PANAFLEX | ANAMORPHIC | PANAVISION PRIMO","2000s | Overhead Close-up"
"https://asset.eyecannndy.com/media/clip/2024/02/11/261707632210.webp","Downtown Kayoto - Changed it","Downtown Kayoto - Changed it (2023)","Downtown Kayoto - Changed it (2023)","Joe Howat","","","MALE | GOLDFISH | KAYOTO | BATHTUB","Overhead Close-up"
"https://asset.eyecannndy.com/media/clip/2024/02/11/261707644653.webp","Taxi Driver","Taxi Driver (1976)","A mentally unstable veteran works as a nighttime taxi driver in New York City, where the perceived decadence and sleaze fuels his urge for violent action.","Melvin Shapiro, Tom Rolf","Michael Chapman","Company 3, Stefan Sonnenfeld","FIXED CAMERA | WHITE | YELLOW | WARM | NIGHT | EXTERIOR | 1970S | EXTREME CLOSE UP | 35MM | ZEISS SUPER SPEED | ARRIFLEX BL | TAXI DRIVER | MICHAEL CHAPMAN | MELVIN SHAPIRO | MARTIN SCORSESE | STEFAN SONNENFELD | VOYEUR","Overhead Close-up"
"https://asset.eyecannndy.com/media/clip/2023/12/24/261703454715.webp","Severance","Severance (2022)","Mark leads a team of office workers whose memories have been surgically divided between their work and personal lives. When a mysterious colleague appears outside of work, it begins a journey to discover the truth about their jobs.","Erica Freed Marker, Geoffrey Richman, Gershon Hinkson","Jessica Lee Gagné, Matt Mitchell, Suzie Lavelle","Company 3, Tom Poole","COOL | COOL WHITE","Overhead Close-up"
"https://asset.eyecannndy.com/media/clip/2024/02/11/261707620484.webp","Carly Gibert - WILLOW","Carly Gibert - WILLOW (2024)","2024 music video performed and directed by artist Carly Gibert.","Carly Gibert","Enzo Iriarte","","WEED | MARIJUANA","Overhead Close-up"
"https://asset.eyecannndy.com/media/clip/2024/02/14/261707898070.webp","The Menu","The Menu (2022)","A young couple travels to a remote island to eat at an exclusive restaurant where the chef has prepared a lavish menu, with some shocking surprises.","Christopher Tellefsen","Peter Deming","Ross Bartels","FIRE | STOVE | OVEN","Overhead Close-up | Slow Motion"
"https://asset.eyecannndy.com/media/clip/2024/02/11/261707644943.webp","Raging Bull","Raging Bull (1980)","The life of boxer Jake LaMotta, whose violence and temper that led him to the top in the ring destroyed his life outside of it.","Thelma Schoonmaker","Michael Chapman","","SPORTS | BLACK AND WHITE | ATHLETE | BOXING","Overhead Close-up"
"https://asset.eyecannndy.com/media/clip/2024/02/11/261707687065.webp","Moonrise Kingdom","Moonrise Kingdom (2012)","A whimsical film set in 1965 New England, portraying the adventures of two young runaways exploring love and adolescence.","Andrew Weisblum","Robert Yeoman","Tim Stipan","","1960s | Overhead Close-up"
"https://asset.eyecannndy.com/media/clip/2024/01/29/261706569942.webp","Knives Out","Knives Out (2019)","A detective investigates the death of the patriarch of an eccentric, combative family.","Bob Ducsay","Steve Yedlin","","INTERIOR | HAND | OVERHEAD | GAME","Overhead Close-up"
"https://asset.eyecannndy.com/media/clip/2024/02/14/261707900468.webp","Nike - Sport Changes Everything, Chicago-Style","Nike - Sport Changes Everything, Chicago-Style (2019)","This spot dishes out Windy City metaphors faster than a hot dog order, glorifying Chicagoans and their sports passion with a side of campaign slogan irony: ""Sport Changes Everything.""","Jack Kanner, Jamie Foord, Rock Paper Scissors","Mihai Malaimare","A52","HOT DOG | RESTAURANT | NIKE | INTERIOR | CHICAGO","Overhead Close-up"
"https://asset.eyecannndy.com/media/clip/2024/01/29/261706567480.webp","The Grand Budapest Hotel","The Grand Budapest Hotel (2014)","A visually stunning and comedic masterpiece set in an eccentric Eastern European hotel.","Barney Pilling","Robert Yeoman","Jill Bogdanowicz","HANDS | DESSERT | CAKE","Close-Up | Overhead Close-up"
"https://asset.eyecannndy.com/media/clip/2024/02/11/261707644728.webp","The Wolf of Wall Street","The Wolf of Wall Street (2013)","Based on the true story of Jordan Belfort, from his rise to a wealthy stock-broker living the high life to his fall involving crime, corruption and the federal government.","Thelma Schoonmaker","Rodrigo Prieto","Yvan Lucas","INTERIOR | TABLE | GUN","1980s | Overhead Close-up"
"https://asset.eyecannndy.com/media/clip/2024/02/11/261707685992.webp","Goodfellas","Goodfellas (1990)","The story of Henry Hill and his life in the mafia, covering his relationship with his wife Karen and his mob partners Jimmy Conway and Tommy DeVito.","James Y. Kwei, Thelma Schoonmaker","Michael Ballhaus","","INTERIOR | MONEY | CASH | BRIEF CASE","Overhead Close-up"
"https://asset.eyecannndy.com/media/clip/2024/02/11/261707687084.webp","Moonrise Kingdom","Moonrise Kingdom (2012)","A whimsical film set in 1965 New England, portraying the adventures of two young runaways exploring love and adolescence.","Andrew Weisblum","Robert Yeoman","Tim Stipan","","1960s | Overhead Close-up"
"https://asset.eyecannndy.com/media/clip/2024/01/25/261706154620.webp","American Psycho","American Psycho (2000)","A wealthy New York City investment banking executive, Patrick Bateman, hides his alternate psychopathic ego from his co-workers and friends as he delves deeper into his violent, hedonistic fantasies.","Andrew Marcus","Andrzej Sekula","Michael Haeley","HAND | AMERICAN PSYCHO | CHRISTIAN BALE | PAPER | NOTE | BUSINESS CARD | PATRICK BATEMAN","Extreme Close-Up | Overhead Close-up"
"https://asset.eyecannndy.com/media/clip/2024/03/09/261709976814.webp","eLaLiga Santander - What Can't Can Be","eLaLiga Santander - What Can't Can Be (2023)","eLaLiga Santander - What Can't Can Be (2023)","Keane Pearce Shaw","","","","Overhead Close-up"
"https://asset.eyecannndy.com/media/clip/2024/02/11/261707686060.webp","Taxi Driver","Taxi Driver (1976)","A mentally unstable veteran works as a nighttime taxi driver in New York City, where the perceived decadence and sleaze fuels his urge for violent action.","Melvin Shapiro, Tom Rolf","Michael Chapman","Company 3, Stefan Sonnenfeld","INTERIOR | GUN","Overhead Close-up"
