video_url,alt_text,title,description,director,dop,colorist,tags,technique_tags
"https://asset.eyecannndy.com/media/clip/2024/03/22/261711139607.webp","Aminé - Charmander","Aminé - Charmander (2021)","In the 2021 music video ""Charmander"" by Aminé, the artist retreats to a secluded cabin in the woods, symbolizing a quest for peace and introspection away from the pressures of fame. The video is characterized by a warm, earthy color palette and natural light, capturing the tranquil beauty of the forest setting. The nostalgic reference to Pokémon through the title ""Charmander"" adds a whimsical contrast to the mature themes of self-discovery and isolation.","Will Tooke","Ben Mullen","Andrew Francis","MALE | EXTERIOR | DOOR | DILATED","Altered state | Drug trip | Fisheye"
"https://asset.eyecannndy.com/media/clip/2024/07/07/261720345029.webp","Oddworld x Souly - wzf / maybach","Oddworld x Souly - wzf / maybach (2024)","The music video for ""WZF / Maybach"" by Oddworld x Souly is a visually striking and dynamic production. The video features high-energy performances and a mix of urban and futuristic aesthetics. With vibrant colors and fast-paced edits, the visual storytelling complements the rhythm and intensity of the track. The artists are showcased in various locations, including industrial backdrops and sleek, modern settings, adding to the video's edgy and stylish vibe. The direction creatively blends elements of hip-hop culture with innovative visual effects, making it a captivating watch from start to finish.","Yannic Nixdorf","Patrick Pichler","","GRAIN | THERMAL","Altered state | Drug trip | Thermal"
"https://asset.eyecannndy.com/media/clip/2024/02/11/261707631827.webp","Valentino Khan - Deep Down Low","Valentino Khan - Deep Down Low (2016)","One of the weirdest music videos you'll ever watch. We don't recommend watching while high. Actually scratch that. Even better when high. Fever, hallucinogens, or the hypnotic beat at the track make his nightmares increasingly bizarre. In the restaurant, dancing facial features and tentacles sprouting from a waitress's eyes push him to flee the surreal scene.","Gaia Borretti","Naoki Noda","Luke Morrison","WOMAN | RESTAURANT | INTERIOR | HORROR | OCTOPUS | TENTACLES | SQUID","Altered state | Drug trip | Magical realism"
"https://asset.eyecannndy.com/media/clip/2024/02/11/261707622716.webp","A$AP Rocky - L$D","A$AP Rocky - L$D (2015)","Shot entirely in Tokyo, L$D borrows heavily from Gaspar Noé’s 2009 psychedelic fantasy film Enter the Void (which, if you ask Noé, also inspired Kanye West’s 2010 music video “All of the Lights”).","Dexter Navy","Oliver Millar","Matt Turner","","Altered state | Drug trip | Light Flash | Towards camera | Tracking"
"https://asset.eyecannndy.com/media/clip/2024/02/11/261707622253.webp","A$AP Rocky - L$D","A$AP Rocky - L$D (2015)","Shot entirely in Tokyo, L$D borrows heavily from Gaspar Noé’s 2009 psychedelic fantasy film Enter the Void (which, if you ask Noé, also inspired Kanye West’s 2010 music video “All of the Lights”).","Dexter Navy","Oliver Millar","Matt Turner","","Altered state | Double Exposure | Drug trip"
